Item,Pronunciation,Phonology,Frequency
lamentation,L AE M AH N T EY SH IH N,lAmxnteSIn,0.06
laminate,L AE M AH N EY T,lAmxnet,0.2
lamp,L AE M P,lAmp,12.88
lamplight,L AE M P L AY T,lAmplYt,0.12
lampoon,L AE M P UW N,lAmpun,0.1
lance,L AE N S,lAns,10.86
land,L AE N D,lAnd,88.12
landau,L AE N D AW,lAndW,0.22
landing,L AE N D IH NG,lAndIG,16.04
landlord,L AE N D L AO R D,lAndlcrd,5.33
landmark,L AE N D M AA R K,lAndmark,1.25
landowner,L AE N D OW N AH R,lAndonxr,0.37
landscape,L AE N D S K EY P,lAndskep,2.49
landslide,L AE N D S L AY D,lAndslYd,0.82
lane,L EY N,len,33.41
language,L AE NG G W IH JH,lAGgwIJ,35.1
languid,L AE NG G W IH D,lAGgwId,0.2
languish,L AE NG G W IH SH,lAGgwIS,0.16
lanky,L AE NG K IY,lAGki,0.43
lantern,L AE N T AH R N,lAntxrn,2.02
lap,L AE P,lAp,13.47
lapel,L AH P EH L,lxpEl,0.49
lapse,L AE P S,lAps,1.37
larceny,L AA R S AH N IY,larsxni,2.22
lard,L AA R D,lard,1.69
larder,L AA R D AH R,lardxr,0.16
large,L AA R JH,larJ,41.45
largely,L AA R JH L IY,larJli,1.65
larger,L AA R JH AH R,larJxr,8.2
largesse,L AA R JH EH S,larJEs,0.18
largest,L AA R JH AH S T,larJxst,7.88
lark,L AA R K,lark,1.63
larkspur,L AA R K S P AH R,larkspxr,0.04
larva,L AA R V AH,larvx,0.25
larval,L AA R V AH L,larvxl,0.14
las,EH L EY EH S,EleEs,18.29
lascivious,L IH S IH V IY AH S,lIsIvixs,0.67
lash,L AE SH,lAS,1.67
lashing,L AE SH IH NG,lASIG,0.45
lass,L AE S,lAs,2.67
lasso,L AE S OW,lAso,0.88
last,L AE S T,lAst,723.1
lasting,L AE S T IH NG,lAstIG,2.35
latch,L AE CH,lAC,1.92
late,L EY T,let,269.73
latent,L EY T AH N T,letxnt,0.76
later,L EY T AH R,letxr,291.94
lateral,L AE T AH R AH L,lAtxrxl,1.53
latest,L EY T IH S T,letIst,18.73
latex,L EY T EH K S,letEks,1.45
lath,L AE TH,lAT,0.06
lathe,L EY DH,leD,0.31
lather,L AE DH AH R,lADxr,0.55
latitude,L AE T IH T UW D,lAtItud,1.59
latter,L AE T AH R,lAtxr,1.25
lattice,L AE T IH S,lAtIs,0.08
laudanum,L AO D AH N AH M,lcdxnxm,0.51
laugh,L AE F,lAf,62.86
laughter,L AE F T AH R,lAftxr,13.8
launch,L AO N CH,lcnC,19.96
launcher,L AO N CH AH R,lcnCxr,0.82
launching,L AO N CH IH NG,lcnCIG,2.39
launder,L AO N D AH R,lcndxr,0.67
laundering,L AO N D AH R IH NG,lcndxrIG,1.37
laundry,L AO N D R IY,lcndri,19.06
laureate,L AO R IY AH T,lcrixt,0.14
laurel,L AO R AH L,lcrxl,3.69
lava,L AA V AH,lavx,3.45
lavatory,L AE V AH T OW R IY,lAvxtori,0.96
lavender,L AE V AH N D AH R,lAvxndxr,2.04
lavish,L AE V IH SH,lAvIS,0.76
lavishly,L AE V IH SH L IY,lAvISli,0.04
law,L AO,lc,116.31
lawful,L AO F AH L,lcfxl,2.18
lawless,L AO L IH S,lclIs,0.43
lawmaker,L AO M EY K AH R,lcmekxr,0.06
lawman,L AO M AE N,lcmAn,1.14
lawn,L AO N,lcn,12.35
lawsuit,L AO S UW T,lcsut,6.1
lawyer,L OY AH R,lOxr,79.51
lax,L AE K S,lAks,1.71
laxative,L AE K S IH T IH V,lAksItIv,0.84
lay,L EY,le,58.24
layer,L EY AH R,lexr,3.71
layette,L EY EH T,leEt,0.08
laying,L EY IH NG,leIG,11.14
layman,L EY M AH N,lemxn,0.94
layoff,L EY AO F,lecf,0.22
layout,L EY AW T,leWt,3.49
laze,L EY Z,lez,0.04
lazy,L EY Z IY,lezi,11.59
lazybones,L EY Z IY B OW N Z,lezibonz,0.16
le,L AH,lx,15.92
leach,L IY CH,liC,0.75
lead,L EH D,lEd,83.25
leaded,L EH D IH D,lEdId,0.45
leaden,L EH D AH N,lEdxn,0.1
leader,L IY D AH R,lidxr,31.16
leaderless,L IY D AH R L AH S,lidxrlxs,0.06
leadership,L IY D AH R SH IH P,lidxrSIp,4.88
leading,L EH D IH NG,lEdIG,20.86
leaf,L IY F,lif,5.2
leaflet,L IY F L IH T,liflIt,0.04
leafy,L IY F IY,lifi,0.47
league,L IY G,lig,18.63
leaguer,L IY G AH R,ligxr,0.31
leak,L IY K,lik,10.14
leakage,L IY K IH JH,likIJ,0.55
leaky,L IY K IY,liki,1.1
lean,L IY N,lin,10.37
lean,L IY N,lin,10.37
lean,L IY N,lin,10.37
lean,L IY N,lin,10.37
leap,L IY P,lip,6.67
leapfrog,L IY P F R AO G,lipfrcg,0.35
learn,L AH R N,lxrn,118.57
learned,L AH R N D,lxrnd,58.12
learner,L AH R N AH R,lxrnxr,1.2
learning,L AH R N IH NG,lxrnIG,20.31
lease,L IY S,lis,6.27
leash,L IY SH,liS,4.29
least,L IY S T,list,207.76
leather,L EH DH AH R,lEDxr,13.59
leathery,L EH DH AH R IY,lEDxri,0.18
leave,L IY V,liv,560.71
leavened,L EH V AH N D,lEvxnd,0.04
leavening,L EH V AH N IH NG,lEvxnIG,0.02
leaving,L IY V IH NG,livIG,141.39
lecher,L EH CH AH R,lECxr,0.1
lecture,L EH K CH AH R,lEkCxr,10.47
lecturer,L EH K CH AH R AH R,lEkCxrxr,0.8
ledge,L EH JH,lEJ,3.51
ledger,L EH JH AH R,lEJxr,1.22
leer,L IH R,lIr,0.51
leeway,L IY W EY,liwe,0.55
left,L EH F T,lEft,484.45
leftist,L EH F T IH S T,lEftIst,0.18
lefty,L EH F T IY,lEfti,3.1
leg,L EH G,lEg,56.51
legacy,L EH G IH S IY,lEgIsi,5.02
legal,L IY G AH L,ligxl,35.71
legality,L IH G AE L IH T IY,lIgAlIti,0.22
legalize,L IY G AH L AY Z,ligxlYz,0.22
legatee,L EH G AH T IY,lEgxti,0.02
legation,L IH G EY SH IH N,lIgeSIn,0.73
legato,L AH G AA T OW,lxgato,0.2
legend,L EH JH IH N D,lEJInd,17.16
legendary,L EH JH IH N D EH R IY,lEJIndEri,4.02
legged,L EH G D,lEgd,0.14
legging,L EH G IH NG,lEgIG,0.04
leggy,L EH G IY,lEgi,0.2
legion,L IY JH IH N,liJIn,2.47
legislate,L EH JH IH S L EY T,lEJIslet,0.31
legislation,L EH JH IH S L EY SH IH N,lEJIsleSIn,1.02
legislative,L EH JH IH S L EY T IH V,lEJIsletIv,0.27
legislator,L EH JH IH S L EY T AH R,lEJIsletxr,0.16
legislature,L EH JH IH S L EY CH AH R,lEJIsleCxr,0.78
legitimacy,L IH JH IH T AH M AH S IY,lIJItxmxsi,0.51
legitimate,L IH JH IH T AH M AH T,lIJItxmxt,7.53
legitimize,L IH JH IH T AH M AY Z,lIJItxmYz,0.1
leisure,L IY ZH AH R,liZxr,2.53
leisurely,L IY ZH AH R L IY,liZxrli,0.57
lemma,L EH M AH,lEmx,0.02
lemon,L EH M AH N,lEmxn,12.02
lemonade,L EH M AH N EY D,lEmxned,5.51
lend,L EH N D,lEnd,11.67
lending,L EH N D IH NG,lEndIG,1.88
length,L EH NG TH,lEGT,7.02
lengthen,L EH NG TH IH N,lEGTIn,0.24
lengthwise,L EH NG TH W AY Z,lEGTwYz,0.29
lengthy,L EH NG K TH IY,lEGkTi,0.73
lenient,L IY N IY AH N T,linixnt,0.9
lens,L EH N Z,lEnz,4.67
lentil,L EH N T AH L,lEntxl,0.22
leopard,L EH P AH R D,lEpxrd,5.41
leprosy,L EH P R IH S IY,lEprIsi,0.73
lesbian,L EH Z B IY AH N,lEzbixn,9.51
lesion,L IY ZH IH N,liZIn,0.59
less,L EH S,lEs,111.1
lessen,L EH S AH N,lEsxn,0.59
lessen,L EH S AH N,lEsxn,0.59
lessen,L EH S AH N,lEsxn,0.59
lessen,L EH S AH N,lEsxn,0.59
lessening,L EH S AH N IH NG,lEsxnIG,0.08
lesser,L EH S AH R,lEsxr,2.69
lesson,L EH S AH N,lEsxn,32.24
lesson,L EH S AH N,lEsxn,32.24
lesson,L EH S AH N,lEsxn,32.24
lesson,L EH S AH N,lEsxn,32.24
lest,L EH S T,lEst,1.96
let,L EH T,lEt,2419.24
lethal,L IY TH AH L,liTxl,5.67
lethality,L IY TH AE L AH T IY,liTAlxti,0.06
lethargy,L EH TH AH R JH IY,lETxrJi,0.12
letter,L EH T AH R,lEtxr,82.61
letterhead,L EH T AH R HH EH D,lEtxrhEd,0.41
lettering,L EH T AH R IH NG,lEtxrIG,0.45
letterman,L EH T AH R M AE N,lEtxrmAn,1.25
letting,L EH T IH NG,lEtIG,39.12
leukemia,L UW K IY M IY AH,lukimix,1.9
levee,L EH V IY,lEvi,0.51
levee,L EH V IY,lEvi,0.51
levee,L EH V IY,lEvi,0.51
levee,L EH V IY,lEvi,0.51
level,L EH V AH L,lEvxl,51.63
leveling,L EH V L IH NG,lEvlIG,0.43
lever,L EH V AH R,lEvxr,3.2
leverage,L EH V AH R IH JH,lEvxrIJ,2.73
levis,L IY V AY Z,livYz,0.14
levitation,L EH V AH T EY SH IH N,lEvxteSIn,0.18
levity,L EH V AH T IY,lEvxti,0.37
levy,L EH V IY,lEvi,1.94
levy,L EH V IY,lEvi,1.94
levy,L EH V IY,lEvi,1.94
levy,L EH V IY,lEvi,1.94
lewd,L UW D,lud,1.27
lex,L EH K S,lEks,2.59
lexicon,L EH K S IH K AA N,lEksIkan,0.12
liability,L AY AH B IH L IH T IY,lYxbIlIti,3.1
liable,L AY AH B AH L,lYxbxl,7.24
liaison,L IY EY Z AA N,liezan,2.73
liar,L AY AH R,lYxr,35.14
libel,L AY B AH L,lYbxl,1.1
libelous,L AY B AH L AH S,lYbxlxs,0.06
liberal,L IH B AH R AH L,lIbxrxl,3.98
liberalism,L IH B AH R AH L IH Z AH M,lIbxrxlIzxm,0.1
liberate,L IH B AH R EY T,lIbxret,1.16
liberation,L IH B AH R EY SH IH N,lIbxreSIn,2.31
libertarian,L IH B AH R T EH R IY IH N,lIbxrtEriIn,0.08
libertine,L IH B AH R T IY N,lIbxrtin,0.18
liberty,L IH B AH R T IY,lIbxrti,16.65
libido,L AH B IY D OW,lxbido,1.12
librarian,L AY B R EH R IY AH N,lYbrErixn,2.88
library,L AY B R EH R IY,lYbrEri,22.94
libretto,L IH B R EH T OW,lIbrEto,0.18
license,L AY S AH N S,lYsxns,32.06
licensee,L AY S AH N S IY,lYsxnsi,0.02
licensing,L AY S AH N S IH NG,lYsxnsIG,0.22
lick,L IH K,lIk,10.96
lid,L IH D,lId,4.92
lidless,L IH D L IH S,lIdlIs,0.04
lie,L AY,lY,120.25
lied,L IY T,lit,43.8
lien,L IY N,lin,0.57
lien,L IY N,lin,0.57
lien,L IY N,lin,0.57
lien,L IY N,lin,0.57
lieu,L UW,lu,1.12
lieutenant,L UW T EH N IH N T,lutEnInt,104.04
life,L AY F,lYf,796.65
lifeblood,L AY F B L AH D,lYfblxd,0.25
lifeboat,L AY F B OW T,lYfbot,1.39
lifeguard,L AY F G AA R D,lYfgard,1.67
lifeless,L AY F L AH S,lYflxs,1.25
lifelike,L AY F L AY K,lYflYk,0.61
lifer,L AY F AH R,lYfxr,0.57
lifetime,L AY F T AY M,lYftYm,18.22
lift,L IH F T,lIft,34.14
lifter,L IH F T AH R,lIftxr,0.24
lifting,L IH F T IH NG,lIftIG,4.33
ligament,L IH G AH M AH N T,lIgxmxnt,0.49
light,L AY T,lYt,165.2
lighten,L AY T AH N,lYtxn,5.9
lighter,L AY T AH R,lYtxr,8.96
lightest,L AY T AH S T,lYtxst,0.22
lighthearted,L AY T HH AA R T IH D,lYthartId,0.22
lighthouse,L AY T HH AW S,lYthWs,3.08
lighting,L AY T IH NG,lYtIG,6.33
lightly,L AY T L IY,lYtli,4.61
lightness,L AY T N IH S,lYtnIs,0.39
lightning,L AY T N IH NG,lYtnIG,14.14
lightweight,L AY T W EY T,lYtwet,1.16
lignite,L IH G N AY T,lIgnYt,0.02
like,L AY K,lYk,3998.96
likelihood,L AY K L IY HH UH D,lYklihUd,1.14
likely,L AY K L IY,lYkli,25.76
liken,L AY K IH N,lYkIn,0.06
likeness,L AY K N IH S,lYknIs,1.92
liking,L AY K IH NG,lYkIG,6.27
lilac,L AY L AH K,lYlxk,0.76
lilliputian,L IH L AH P Y UW SH AH N,lIlxpyuSxn,0.04
lilt,L IH L T,lIlt,0.24
lily,L IH L IY,lIli,26.86
limb,L IH M,lIm,4.67
limber,L IH M B AH R,lImbxr,0.82
limbic,L IH M B IH K,lImbIk,0.18
limbo,L IH M B OW,lImbo,2.37
lime,L AY M,lYm,3.29
limelight,L AY M L AY T,lYmlYt,0.75
limit,L IH M IH T,lImIt,13.02
limitation,L IH M IH T EY SH IH N,lImIteSIn,0.29
limitless,L IH M IH T L IH S,lImItlIs,0.71
limousine,L IH M AH Z IY N,lImxzin,2.82
limp,L IH M P,lImp,3.67
limpid,L IH M P IH D,lImpId,0.08
linden,L IH N D IH N,lIndIn,1.16
line,L AY N,lYn,206.18
lineage,L IH N IY IH JH,lIniIJ,0.84
linear,L IH N IY AH R,lInixr,0.55
linebacker,L AY N B AE K AH R,lYnbAkxr,0.59
lineman,L AY N M AH N,lYnmxn,0.2
linen,L IH N IH N,lInIn,2.92
liner,L AY N AH R,lYnxr,1.22
lineup,L AY N AH P,lYnxp,2.82
linger,L IH NG G AH R,lIGgxr,1.45
lingerie,L AA N JH AH R EY,lanJxre,2.82
lingo,L IH NG G OW,lIGgo,1.16
linguist,L IH NG G W IH S T,lIGgwIst,0.53
linguistic,L IH NG G W IH S T IH K,lIGgwIstIk,0.35
linguistics,L IH NG G W IH S T IH K S,lIGgwIstIks,0.49
liniment,L IH N AH M AH N T,lInxmxnt,0.39
link,L IH NG K,lIGk,11.94
linkage,L IH NG K IH JH,lIGkIJ,0.29
linking,L IH NG K IH NG,lIGkIG,1.31
linoleum,L IH N OW L IY AH M,lInolixm,0.53
lint,L IH N T,lInt,1.33
lion,L AY IH N,lYIn,15.35
lioness,L AY AH N IH S,lYxnIs,0.33
lionize,L AY IH N AY Z,lYInYz,0.02
lip,L IH P,lIp,10.75
lipstick,L IH P S T IH K,lIpstIk,8.8
liqueur,L IH K AH R,lIkxr,0.55
liqueur,L IH K AH R,lIkxr,0.55
liqueur,L IH K AH R,lIkxr,0.55
liqueur,L IH K AH R,lIkxr,0.55
liquid,L IH K W IH D,lIkwId,7.75
liquidate,L IH K W AH D EY T,lIkwxdet,0.76
liquidation,L IH K W AH D EY SH IH N,lIkwxdeSIn,0.14
liquidity,L IH K W IH D IH T IY,lIkwIdIti,0.06
liquor,L IH K AH R,lIkxr,17.29
liquor,L IH K AH R,lIkxr,17.29
liquor,L IH K AH R,lIkxr,17.29
liquor,L IH K AH R,lIkxr,17.29
lisp,L IH S P,lIsp,0.41
list,L IH S T,lIst,80.59
listen,L IH S AH N,lIsxn,544.78
listener,L IH S N AH R,lIsnxr,1.41
listing,L IH S T IH NG,lIstIG,1.88
listless,L IH S T L AH S,lIstlxs,0.18
lit,L IH T,lIt,9.73
liter,L IY T AH R,litxr,1.75
literal,L IH T AH R AH L,lItxrxl,1.35
literally,L IH T AH R AH L IY,lItxrxli,14.49
literary,L IH T AH R EH R IY,lItxrEri,2.55
literate,L IH T AH R IH T,lItxrIt,0.33
literature,L IH T AH R AH CH UH R,lItxrxCUr,6.39
lithe,L AY DH,lYD,0.04
lithograph,L IH TH AH G R AE F,lITxgrAf,0.06
litigant,L IH T IH G IH N T,lItIgInt,0.06
litigation,L IH T IH G EY SH IH N,lItIgeSIn,1.45
litter,L IH T AH R,lItxr,3.92
litterbug,L IH T AH R B AH G,lItxrbxg,0.06
little,L IH T AH L,lItxl,1446.39
littlest,L IH T AH L AH S T,lItxlxst,0.61
livable,L IH V AH B AH L,lIvxbxl,0.27
live,L IH V,lIv,344.59
livelier,L AY V L IY AH R,lYvlixr,0.14
livelihood,L AY V L IY HH UH D,lYvlihUd,1.49
lively,L AY V L IY,lYvli,4.06
liver,L IH V AH R,lIvxr,14.29
livery,L IH V AH R IY,lIvxri,1.27
livestock,L AY V S T AA K,lYvstak,2
livid,L IH V IH D,lIvId,0.43
living,L IH V IH NG,lIvIG,156.53
lizard,L IH Z AH R D,lIzxrd,4.84
load,L OW D,lod,29.22
loader,L OW D AH R,lodxr,0.45
loading,L OW D IH NG,lodIG,4.86
loaf,L OW F,lof,4.47
loan,L OW N,lon,19.86
loan,L OW N,lon,19.86
loan,L OW N,lon,19.86
loan,L OW N,lon,19.86
loath,L OW TH,loT,0.1
loathe,L OW DH,loD,2.08
loathing,L OW DH IH NG,loDIG,0.49
loathsome,L OW TH S AH M,loTsxm,1.04
lob,L AA B,lab,0.27
lobar,L OW B AH R,lobxr,0.02
lobby,L AA B IY,labi,12.69
lobe,L OW B,lob,1.86
lobo,L OW B OW,lobo,0.84
lobscouse,L AA B S K AW S,labskWs,0.02
lobster,L AA B S T AH R,labstxr,7.33
local,L OW K AH L,lokxl,41.73
locale,L OW K AE L,lokAl,0.31
locality,L OW K AE L IH T IY,lokAlIti,0.12
localization,L OW K AH L AH Z EY SH IH N,lokxlxzeSIn,0.02
localize,L OW K AH L AY Z,lokxlYz,0.02
locate,L OW K EY T,loket,10.27
location,L OW K EY SH IH N,lokeSIn,24.76
lock,L AA K,lak,56.57
locker,L AA K AH R,lakxr,15.98
lockup,L AA K AH P,lakxp,1.35
locomotive,L OW K AH M OW T IH V,lokxmotIv,0.8
locus,L OW K IH S,lokIs,0.33
locust,L OW K IH S T,lokIst,0.86
lodge,L AA JH,laJ,6.69
lodging,L AA JH IH NG,laJIG,0.84
loft,L AO F T,lcft,3.65
lofty,L AO F T IY,lcfti,0.78
log,L AO G,lcg,11.96
logarithm,L AO G AH R IH DH AH M,lcgxrIDxm,0.04
logger,L AO G AH R,lcgxr,0.12
logging,L AO G IH NG,lcgIG,0.9
logic,L AA JH IH K,laJIk,6.71
logical,L AA JH IH K AH L,laJIkxl,7.39
logistic,L OW JH IH S T IH K,loJIstIk,0.04
logistical,L AH JH IH S T IH K AH L,lxJIstIkxl,0.27
logistics,L OW JH IH S T IH K S,loJIstIks,0.71
loin,L OY N,lOn,0.35
loincloth,L OY N K L AO TH,lOnklcT,0.18
loll,L AA L,lal,0.1
lone,L OW N,lon,5.25
lone,L OW N,lon,5.25
lone,L OW N,lon,5.25
lone,L OW N,lon,5.25
lonelier,L OW N L IY AH R,lonlixr,0.27
loneliness,L OW N L IY N AH S,lonlinxs,5
lonely,L OW N L IY,lonli,41.67
loner,L OW N AH R,lonxr,3.1
lonesome,L OW N S AH M,lonsxm,7
long,L AO NG,lcG,675.16
longer,L AO NG G AH R,lcGgxr,98.94
longest,L AO NG G IH S T,lcGgIst,4.76
longevity,L AA N JH EH V AH T IY,lanJEvxti,0.55
longhorn,L AO NG HH AO R N,lcGhcrn,0.31
longing,L AO NG IH NG,lcGIG,2.84
longish,L AO NG IH SH,lcGIS,0.06
longitude,L AA N JH IH T UW D,lanJItud,0.82
longitudinal,L AA N JH AH T UW D AH N AH L,lanJxtudxnxl,0.08
longshoreman,L AO NG SH OW R M AH N,lcGSormxn,0.27
longshot,L AO NG SH AA T,lcGSat,0.1
longstanding,L AO NG S T AE N D IH NG,lcGstAndIG,0.16
look,L UH K,lUk,1947.27
looking,L UH K IH NG,lUkIG,432.67
lookout,L UH K AW T,lUkWt,4.45
lookup,L UH K AH P,lUkxp,0.04
loom,L UW M,lum,0.41
loon,L UW N,lun,1.41
loop,L UW P,lup,6.76
loophole,L UW P HH OW L,luphol,1.02
loose,L UW S,lus,41.78
loosely,L UW S L IY,lusli,0.8
loosen,L UW S AH N,lusxn,5.53
loot,L UW T,lut,3.55
loot,L UW T,lut,3.55
loot,L UW T,lut,3.55
loot,L UW T,lut,3.55
lop,L AA P,lap,0.43
lope,L OW P,lop,0.12
loquacious,L OW K W EY SH IH S,lokweSIs,0.16
lord,L AO R D,lcrd,138.16
lordly,L AO R D L IY,lcrdli,0.14
lordship,L AO R D SH IH P,lcrdSIp,3.24
lore,L OW R,lor,0.67
lose,L UW Z,luz,164.35
loser,L UW Z AH R,luzxr,27.08
loss,L AO S,lcs,29.12
lot,L AA T,lat,569.92
lotion,L OW SH IH N,loSIn,3.25
lots,L AA T S,lats,60.16
lottery,L AA T AH R IY,latxri,6.75
lotus,L OW T AH S,lotxs,2.04
loud,L AW D,lWd,39.82
louder,L AW D AH R,lWdxr,10.1
loudest,L AW D AH S T,lWdxst,0.67
loudspeaker,L AW D S P IY K AH R,lWdspikxr,0.92
lounge,L AW N JH,lWnJ,7.86
louse,L AW S,lWs,1.69
lousy,L AW Z IY,lWzi,23.73
lovable,L AH V AH B AH L,lxvxbxl,1.78
love,L AH V,lxv,1114.98
lovelorn,L AH V L AO R N,lxvlcrn,0.31
lovely,L AH V L IY,lxvli,95.16
lover,L AH V AH R,lxvxr,26.63
low,L OW,lo,59.14
lower,L OW AH R,loxr,27.78
lowering,L AW AH R IH NG,lWxrIG,1.16
lowest,L OW AH S T,loxst,4.41
lowland,L OW L IH N D,lolInd,0.12
lowliest,L OW L IY AH S T,lolixst,0.16
lowly,L OW L IY,loli,1.71
loyal,L OY AH L,lOxl,12
loyalist,L OY AH L IH S T,lOxlIst,0.18
loyalty,L OY AH L T IY,lOxlti,11.67
lubricant,L UW B R IH K IH N T,lubrIkInt,0.69
lubricate,L UW B R IH K EY T,lubrIket,0.16
lubrication,L UW B R AH K EY SH IH N,lubrxkeSIn,0.25
lucid,L UW S IH D,lusId,1.27
lucidity,L UW S IH D IH T IY,lusIdIti,0.27
luck,L AH K,lxk,153.73
luckier,L AH K IY AH R,lxkixr,0.94
lucky,L AH K IY,lxki,143.45
lucrative,L UW K R AH T IH V,lukrxtIv,1.29
lucy,L UW S IY,lusi,41.8
ludicrous,L UW D AH K R IH S,ludxkrIs,1.65
ludicrousness,L UW D AH K R AH S N EH S,ludxkrxsnEs,0.02
lug,L AH G,lxg,2.59
luggage,L AH G IH JH,lxgIJ,11.12
lukewarm,L UW K W AO R M,lukwcrm,0.47
lull,L AH L,lxl,1.18
lullaby,L AH L IH B AY,lxlIbY,1.73
lulu,L UW L UW,lulu,4.98
lumbar,L AH M B AH R,lxmbxr,1.02
lumbar,L AH M B AH R,lxmbxr,1.02
lumbar,L AH M B AH R,lxmbxr,1.02
lumbar,L AH M B AH R,lxmbxr,1.02
lumber,L AH M B AH R,lxmbxr,2.47
lumber,L AH M B AH R,lxmbxr,2.47
lumber,L AH M B AH R,lxmbxr,2.47
lumber,L AH M B AH R,lxmbxr,2.47
lumen,L UW M AH N,lumxn,0.06
luminary,L UW M AH N EH R IY,lumxnEri,0.1
luminescence,L UW M AH N EH S AH N S,lumxnEsxns,0.08
luminescent,L UW M AH N EH S AH N T,lumxnEsxnt,0.06
luminosity,L UW M AH N AA S IH T IY,lumxnasIti,0.04
luminous,L UW M AH N IH S,lumxnIs,0.76
lummox,L AH M AH K S,lxmxks,0.27
lump,L AH M P,lxmp,3.55
lumpy,L AH M P IY,lxmpi,1.75
lunar,L UW N AH R,lunxr,2.06
lunatic,L UW N IH T IH K,lunItIk,8.49
lunch,L AH N CH,lxnC,104.12
luncheon,L AH N CH IH N,lxnCIn,3.27
lunchroom,L AH N CH R UW M,lxnCrum,0.33
lunchtime,L AH N CH T AY M,lxnCtYm,2.45
lung,L AH NG,lxG,8.24
lunge,L AH N JH,lxnJ,0.47
lurch,L AH R CH,lxrC,0.84
lure,L UH R,lUr,4.25
lurid,L UH R IH D,lUrId,0.65
lurk,L AH R K,lxrk,0.41
luscious,L AH SH IH S,lxSIs,1.27
lush,L AH SH,lxS,1.18
lust,L AH S T,lxst,5.57
luster,L AH S T AH R,lxstxr,0.31
lustful,L AH S T F AH L,lxstfxl,0.39
lustrous,L AH S T R AH S,lxstrxs,0.29
lusty,L AH S T IY,lxsti,0.61
lute,L UW T,lut,0.37
lute,L UW T,lut,0.37
lute,L UW T,lut,0.37
lute,L UW T,lut,0.37
luxurious,L AH G ZH UH R IY AH S,lxgZUrixs,1.12
luxury,L AH K SH AH R IY,lxkSxri,6.02
lymph,L IH M F,lImf,0.27
lymphocyte,L IH M F AH S AY T,lImfxsYt,0.16
lymphoma,L IH M F OW M AH,lImfomx,0.55
lynch,L IH N CH,lInC,5.04
lyric,L IH R AH K,lIrxk,1.1
lyrical,L IH R IH K AH L,lIrIkxl,0.51
lyricism,L IH R IH S IH Z AH M,lIrIsIzxm,0.04
lyricist,L IH R IH S IH S T,lIrIsIst,0.18
m,EH M,Em,6730.29
m,EH M,Em,6730.29
ma,M AA,ma,185.8
macabre,M AH K AA B AH R,mxkabxr,0.37
machine,M AH SH IY N,mxSin,70.25
machinery,M AH SH IY N AH R IY,mxSinxri,3.67
machinist,M AH SH IY N IH S T,mxSinIst,0.41
mackerel,M AE K AH R AH L,mAkxrxl,2.12
mackinaw,M AE K AH N AO,mAkxnc,0.31
mackintosh,M AE K IH N T AA SH,mAkIntaS,0.12
mad,M AE D,mAd,113.41
madam,M AE D AH M,mAdxm,44
madden,M AE D AH N,mAdxn,0.57
madding,M AE D IH NG,mAdIG,0.06
mademoiselle,M AE D AH M W AH Z EH L,mAdxmwxzEl,8.18
madhouse,M AE D HH AW S,mAdhWs,1.31
madman,M AE D M AE N,mAdmAn,5.27
madness,M AE D N IH S,mAdnIs,8.45
madrigal,M AE D R IH G AH L,mAdrIgxl,0.14
maelstrom,M EY L S T R AH M,melstrxm,0.1
maestro,M AY S T R OW,mYstro,2.98
mag,M AE G,mAg,1.53
magazine,M AE G AH Z IY N,mAgxzin,33.2
magenta,M AH JH EH N T AH,mxJEntx,0.63
maggot,M AE G IH T,mAgIt,1.59
maggoty,M AE G AH T IY,mAgxti,0.12
magic,M AE JH IH K,mAJIk,52.69
magical,M AE JH IH K AH L,mAJIkxl,9.1
magician,M AH JH IH SH IH N,mxJISIn,7.65
magistrate,M AE JH IH S T R EY T,mAJIstret,1.37
magnanimity,M AE G N AH N IH M AH T IY,mAgnxnImxti,0.04
magnate,M AE G N EY T,mAgnet,0.24
magnet,M AE G N IH T,mAgnIt,2.75
magnetic,M AE G N EH T IH K,mAgnEtIk,4.22
magnetism,M AE G N IH T IH Z AH M,mAgnItIzxm,0.96
magnetize,M AE G N IH T AY Z,mAgnItYz,0.06
magnification,M AE G N AH F AH K EY SH IH N,mAgnxfxkeSIn,0.53
magnificence,M AE G N IH F IH S AH N S,mAgnIfIsxns,0.65
magnificent,M AE G N IH F IH S IH N T,mAgnIfIsInt,13.22
magnificently,M AE G N IH F IH S AH N T L IY,mAgnIfIsxntli,0.55
magnify,M AE G N AH F AY,mAgnxfY,0.59
magnitude,M AE G N IH T UW D,mAgnItud,1.43
magnolia,M AE G N OW L Y AH,mAgnolyx,0.71
magnum,M AE G N AH M,mAgnxm,12.02
magpie,M AE G P AY,mAgpY,0.47
mahogany,M AH HH AA G IH N IY,mxhagIni,0.75
maid,M EY D,med,22.82
maiden,M EY D AH N,medxn,5.53
mail,M EY L,mel,36.84
mail,M EY L,mel,36.84
mail,M EY L,mel,36.84
mail,M EY L,mel,36.84
mailbox,M EY L B AA K S,melbaks,4.16
mailing,M EY L IH NG,melIG,1.31
mailman,M EY L M AE N,melmAn,2.88
maim,M EY M,mem,0.43
main,M EY N,men,42.73
main,M EY N,men,42.73
main,M EY N,men,42.73
main,M EY N,men,42.73
mainland,M EY N L AH N D,menlxnd,3.02
mainly,M EY N L IY,menli,5.02
mainstream,M EY N S T R IY M,menstrim,1.24
maintain,M EY N T EY N,menten,12.96
maintenance,M EY N T IH N IH N S,mentInIns,6.84
majestic,M AH JH EH S T IH K,mxJEstIk,1.37
majestically,M AH JH EH S T IH K L IY,mxJEstIkli,0.16
majesty,M AE JH IH S T IY,mAJIsti,36.53
major,M EY JH AH R,meJxr,104.76
majority,M AH JH AO R IH T IY,mxJcrIti,5.12
make,M EY K,mek,1387.75
maker,M EY K AH R,mekxr,4.92
makeshift,M EY K SH IH F T,mekSIft,0.39
making,M EY K IH NG,mekIG,222.53
maladaptive,M AE L AH D AE P T IH V,mAlxdAptIv,0.02
maladjusted,M AE L AH JH AH S T IH D,mAlxJxstId,0.2
maladjustment,M AE L AH JH AH S T M AH N T,mAlxJxstmxnt,0.08
malady,M AE L AH D IY,mAlxdi,0.43
malaise,M AE L EY Z,mAlez,0.16
malaria,M AH L EH R IY AH,mxlErix,1.67
male,M EY L,mel,33.94
male,M EY L,mel,33.94
male,M EY L,mel,33.94
male,M EY L,mel,33.94
malediction,M AE L AH D IH K SH IH N,mAlxdIkSIn,0.02
malevolent,M AH L EH V AH L AH N T,mxlEvxlxnt,0.35
malformation,M AE L F AO R M EY SH IH N,mAlfcrmeSIn,0.12
malformed,M AE L F AO R M D,mAlfcrmd,0.14
malfunctioning,M AE L F AH NG K SH AH N IH NG,mAlfxGkSxnIG,0.75
malice,M AE L AH S,mAlxs,1.18
malicious,M AH L IH SH IH S,mxlISIs,1.57
malign,M AH L AY N,mxlYn,0.2
malignancy,M AH L IH G N AH N S IY,mxlIgnxnsi,0.14
mall,M AO L,mcl,18.9
mall,M AO L,mcl,18.9
mall,M AO L,mcl,18.9
mall,M AO L,mcl,18.9
malleable,M AE L IY AH B AH L,mAlixbxl,0.1
malnourished,M AE L N AH R IH SH T,mAlnxrISt,0.16
malnutrition,M AE L N UW T R IH SH IH N,mAlnutrISIn,0.45
malt,M AO L T,mclt,1.65
maltreat,M AE L T R IY T,mAltrit,0.04
mama,M AA M AH,mamx,103.71
mammal,M AE M AH L,mAmxl,1.22
mammalian,M AH M EY L IY AH N,mxmelixn,0.12
mammoth,M AE M AH TH,mAmxT,0.78
man,M AE N,mAn,1845.75
mana,M AA N AA,mana,0.04
manage,M AE N IH JH,mAnIJ,21.47
management,M AE N IH JH M AH N T,mAnIJmxnt,11.65
manager,M AE N IH JH AH R,mAnIJxr,39.96
managerial,M AE N AH JH IH R IY AH L,mAnxJIrixl,0.41
mandate,M AE N D EY T,mAndet,1.49
mandatory,M AE N D IH T OW R IY,mAndItori,2.47
mane,M EY N,men,0.59
mane,M EY N,men,0.59
mane,M EY N,men,0.59
mane,M EY N,men,0.59
maneuver,M AH N UW V AH R,mxnuvxr,2.8
maneuverability,M AH N UW V R AH B IH L IH T IY,mxnuvrxbIlIti,0.12
maneuvering,M AH N UW V AH R IH NG,mxnuvxrIG,1.02
manganese,M AE NG G IH N IY Z,mAGgIniz,0.22
mangle,M AE NG G AH L,mAGgxl,0.27
manhood,M AE N HH UH D,mAnhUd,2.86
mania,M EY N IY AH,menix,1.02
maniac,M EY N IY AE K,meniAk,9.39
maniacal,M AH N AY AH K AH L,mxnYxkxl,0.53
manic,M AE N IH K,mAnIk,1.37
manifest,M AE N AH F EH S T,mAnxfEst,3.69
manifestation,M AE N AH F IH S T EY SH IH N,mAnxfIsteSIn,1.04
manifold,M AE N AH F OW L D,mAnxfold,0.49
manila,M AH N IH L AH,mxnIlx,1.45
manipulate,M AH N IH P Y UH L EY T,mxnIpyUlet,3.47
manipulation,M AH N IH P Y UH L EY SH IH N,mxnIpyUleSIn,1.35
manipulator,M AH N IH P Y AH L EY T AH R,mxnIpyxletxr,0.2
mankind,M AE N K AY N D,mAnkYnd,8.76
manly,M AE N L IY,mAnli,4.04
mannequin,M AE N IH K IH N,mAnIkIn,1.22
manner,M AE N AH R,mAnxr,11.53
manner,M AE N AH R,mAnxr,11.53
manner,M AE N AH R,mAnxr,11.53
manner,M AE N AH R,mAnxr,11.53
mannered,M AE N AH R D,mAnxrd,0.14
mannerism,M AE N AH R IH Z AH M,mAnxrIzxm,0.04
mano,M AA N OW,mano,1.49
manometer,M AH N AA M IH T AH R,mxnamItxr,0.06
manor,M AE N AH R,mAnxr,3.41
manor,M AE N AH R,mAnxr,3.41
manor,M AE N AH R,mAnxr,3.41
manor,M AE N AH R,mAnxr,3.41
manpower,M AE N P AW AH R,mAnpWxr,2.06
manse,M AE N S,mAns,0.04
manservant,M AE N S AH R V AH N T,mAnsxrvxnt,0.29
mansion,M AE N CH IH N,mAnCIn,6.45
manslaughter,M AE N S L AO T AH R,mAnslctxr,2.75
mantel,M AE N T AH L,mAntxl,0.75
mantel,M AE N T AH L,mAntxl,0.75
mantel,M AE N T AH L,mAntxl,0.75
mantel,M AE N T AH L,mAntxl,0.75
mantelpiece,M AE N T AH L P IY S,mAntxlpis,0.35
mantic,M AE N T IH K,mAntIk,0.02
mantle,M AE N T AH L,mAntxl,2.16
mantle,M AE N T AH L,mAntxl,2.16
mantle,M AE N T AH L,mAntxl,2.16
mantle,M AE N T AH L,mAntxl,2.16
mantrap,M AE N T R AE P,mAntrAp,0.1
manual,M AE N Y UW AH L,mAnyuxl,8
manufacture,M AE N Y UW F AE K CH AH R,mAnyufAkCxr,2.43
manufacturer,M AE N Y AH F AE K CH AH R AH R,mAnyxfAkCxrxr,1.78
manufacturing,M AE N Y AH F AE K CH AH R IH NG,mAnyxfAkCxrIG,1.69
manumission,M AE N Y AH M IH SH AH N,mAnyxmISxn,0.04
manure,M AH N UH R,mxnUr,2.08
manuscript,M AE N Y UW S K R IH P T,mAnyuskrIpt,2.69
many,M EH N IY,mEni,359.43
map,M AE P,mAp,31.82
maple,M EY P AH L,mepxl,3.24
mapping,M AE P IH NG,mApIG,0.84
mar,M AA R,mar,4.02
marathon,M AE R AH TH AA N,mArxTan,4.47
marauder,M AH R AO D AH R,mxrcdxr,0.14
marble,M AA R B AH L,marbxl,5.22
march,M AA R CH,marC,24.02
marching,M AA R CH IH NG,marCIG,6.55
mare,M AE R,mAr,2.9
margin,M AA R JH IH N,marJIn,1.96
marginal,M AA R JH AH N AH L,marJxnxl,0.55
marijuana,M AE R AH W AA N AH,mArxwanx,5.31
marimba,M AH R IH M B AH,mxrImbx,0.04
marina,M AH R IY N AH,mxrinx,4.71
marinade,M AA R IH N EY D,marIned,0.06
marinate,M AE R AH N EY T,mArxnet,0.37
marine,M AH R IY N,mxrin,14.08
mariner,M AE R AH N AH R,mArxnxr,0.43
marionette,M AE R IY AH N EH T,mArixnEt,0.14
marital,M AE R AH T AH L,mArxtxl,2.06
maritime,M AE R AH T AY M,mArxtYm,0.73
mark,M AA R K,mark,82.02
marked,M AA R K T,markt,10.73
markedly,M AA R K IH D L IY,markIdli,0.06
marker,M AA R K AH R,markxr,5.24
market,M AA R K IH T,markIt,36.24
marketability,M AA R K IH T AH B IH L IH T IY,markItxbIlIti,0.06
marketable,M AA R K IH T AH B AH L,markItxbxl,0.27
marketing,M AA R K AH T IH NG,markxtIG,4.76
marketplace,M AA R K IH T P L EY S,markItples,1.63
marking,M AA R K IH NG,markIG,1.61
marksman,M AA R K S M AH N,marksmxn,1.45
marksmanship,M AA R K S M AH N SH IH P,marksmxnSIp,0.45
marmalade,M AA R M AH L EY D,marmxled,1.02
maroon,M AH R UW N,mxrun,1.2
