Item,Pronunciation,Phonology,Frequency
ravine,R AH V IY N,rxvin,1.84
raving,R EY V IH NG,revIG,3.16
raw,R AO,rc,10.18
rawhide,R AO HH AY D,rchYd,1.1
ray,R EY,re,97.37
raze,R EY Z,rez,0.16
raze,R EY Z,rez,0.16
raze,R EY Z,rez,0.16
raze,R EY Z,rez,0.16
razor,R EY Z AH R,rezxr,6.88
razor,R EY Z AH R,rezxr,6.88
razor,R EY Z AH R,rezxr,6.88
razor,R EY Z AH R,rezxr,6.88
razorback,R EY Z AH R B AE K,rezxrbAk,0.1
re,R IY,ri,6099.45
reach,R IY CH,riC,56.92
react,R IY AE K T,riAkt,7.55
reaction,R IY AE K SH IH N,riAkSIn,16.27
reactionary,R IY AE K SH AH N EH R IY,riAkSxnEri,0.33
reactivate,R IY AE K T AH V EY T,riAktxvet,0.37
reactor,R IY AE K T AH R,riAktxr,4
read,R IY D,rid,241.22
readable,R IY D AH B AH L,ridxbxl,0.18
readable,R IY D AH B AH L,ridxbxl,0.18
readable,R IY D AH B AH L,ridxbxl,0.18
readable,R IY D AH B AH L,ridxbxl,0.18
reader,R IY D AH R,ridxr,5.45
readily,R EH D AH L AA IY,rEdxlai,1.12
readiness,R EH D IY N AH S,rEdinxs,1.18
reading,R IY D IH NG,ridIG,61.43
readjust,R IY AH JH AH S T,rixJxst,0.25
readjustment,R IY AH JH AH S T M AH N T,rixJxstmxnt,0.25
ready,R EH D IY,rEdi,387.8
reaffirm,R IY AH F AH R M,rixfxrm,0.14
reaffirmation,R IY AE F AH R M EY SH AH N,riAfxrmeSxn,0.04
reagent,R IY EY JH IH N T,rieJInt,0.24
real,R IY AH L,rixl,442.8
realign,R IY AH L AY N,rixlYn,0.27
realism,R IY AH L IH Z AH M,rixlIzxm,0.71
realist,R IY AH L IH S T,rixlIst,0.88
realistic,R IY AH L IH S T IH K,rixlIstIk,4.61
realistically,R IY AH L IH S T IH K L IY,rixlIstIkli,0.49
reality,R IY AE L IH T IY,riAlIti,30.25
realization,R IY AH L AH Z EY SH IH N,rixlxzeSIn,1.06
realize,R IY AH L AY Z,rixlYz,79.06
really,R IY L IY,rili,1500.16
realm,R EH L M,rElm,4.67
realtor,R IY AH L T AH R,rixltxr,1.8
realty,R IY AH L T IY,rixlti,0.49
ream,R IY M,rim,0.22
reap,R IY P,rip,2.59
reappear,R IY AH P IH R,rixpIr,0.33
reappearance,R IY AH P IH R AH N S,rixpIrxns,0.16
reapportionment,R IY AH P OW R SH AH N M AH N T,rixporSxnmxnt,0.02
reappraisal,R IY AH P R EY Z AH L,rixprezxl,0.08
rear,R IH R,rIr,12.43
rearguard,R IY R G AA R D,rirgard,0.1
rearing,R IH R IH NG,rIrIG,0.2
rearm,R IY AA R M,riarm,0.16
rearrange,R IY AH R EY N JH,rixrenJ,1.73
reason,R IY Z AH N,rizxn,193.29
reasonable,R IY Z AH N AH B AH L,rizxnxbxl,18.55
reasonably,R IY Z AH N AH B L IY,rizxnxbli,2.31
reasoning,R IY Z AH N IH NG,rizxnIG,1.82
reassemble,R IY AH S EH M B AH L,rixsEmbxl,0.37
reassert,R IY AH S AH R T,rixsxrt,0.04
reassign,R IY AH S AY N,rixsYn,0.53
reassurance,R IY AH SH UH R AH N S,rixSUrxns,0.59
reassure,R IY AH SH UH R,rixSUr,0.88
reassuring,R IY AH SH UH R IH NG,rixSUrIG,1.41
reawaken,R IY AH W EY K AH N,rixwekxn,0.06
rebel,R EH B AH L,rEbxl,5.35
rebellion,R IH B EH L Y AH N,rIbElyxn,2.55
rebellious,R IH B EH L Y AH S,rIbElyxs,0.92
rebirth,R IY B AH R TH,ribxrT,1.04
reborn,R IY B AO R N,ribcrn,2.61
rebound,R IY B AW N D,ribWnd,2.78
rebuff,R IH B AH F,rIbxf,0.08
rebuild,R IY B IH L D,ribIld,3.37
rebuilding,R IY B IH L D IH NG,ribIldIG,1.31
rebuke,R IH B Y UW K,rIbyuk,0.29
rebut,R IH B AH T,rIbxt,0.16
rebuttal,R IH B AH T AH L,rIbxtxl,0.76
recalcitrant,R IH K AE L S IH T R AH N T,rIkAlsItrxnt,0.12
recalculate,R IY K AE L K Y AH L EY T,rikAlkyxlet,0.06
recall,R IH K AO L,rIkcl,19.67
recalling,R IH K AO L IH NG,rIkclIG,0.41
recant,R IH K AE N T,rIkAnt,0.53
recapitulate,R IH K AH P IH CH AH L EY T,rIkxpICxlet,0.04
recapitulation,R IY K AH P IH CH AH L EY SH AH N,rikxpICxleSxn,0.02
recapture,R IY K AE P CH AH R,rikApCxr,0.8
recede,R IH S IY D,rIsid,0.12
receipt,R IH S IY T,rIsit,7.43
receive,R IH S IY V,rIsiv,19.45
receiver,R IH S IY V AH R,rIsivxr,2.96
recent,R IY S AH N T,risxnt,13.12
receptacle,R IH S EH P T IH K AH L,rIsEptIkxl,0.43
reception,R IH S EH P SH IH N,rIsEpSIn,11.14
receptionist,R IH S EH P SH AH N IH S T,rIsEpSxnIst,1.9
receptive,R IH S EH P T IH V,rIsEptIv,1.18
recess,R IY S EH S,risEs,3.49
recession,R IH S EH SH IH N,rIsESIn,0.45
recheck,R IY CH EH K,riCEk,0.53
recipe,R EH S AH P IY,rEsxpi,7.61
recipient,R IH S IH P IY AH N T,rIsIpixnt,1.16
reciprocal,R IH S IH P R AH K AH L,rIsIprxkxl,0.45
reciprocate,R IH S IH P R AH K EY T,rIsIprxket,0.51
recital,R IH S AY T AH L,rIsYtxl,2.94
recitation,R EH S AH T EY SH IH N,rEsxteSIn,0.47
recite,R IH S AY T,rIsYt,3
reckless,R EH K L AH S,rEklxs,4.92
recklessness,R EH K L AH S N AH S,rEklxsnxs,0.29
reckon,R EH K IH N,rEkIn,11.69
reckoning,R EH K AH N IH NG,rEkxnIG,1.08
reclaim,R IH K L EY M,rIklem,1.39
recline,R IH K L AY N,rIklYn,0.16
recluse,R EH K L UW S,rEklus,0.67
recognition,R EH K AH G N IH SH IH N,rEkxgnISIn,4.57
recognizable,R EH K AH G N AY Z AH B AH L,rEkxgnYzxbxl,0.61
recognize,R EH K AH G N AY Z,rEkxgnYz,34.31
recoil,R IH K OY L,rIkOl,0.43
recoilless,R IH K OY L AH S,rIkOlxs,0.12
recollect,R EH K AH L EH K T,rEkxlEkt,1.06
recollection,R EH K AH L EH K SH AH N,rEkxlEkSxn,1.57
recommend,R EH K AH M EH N D,rEkxmEnd,14
recommendation,R EH K AH M EH N D EY SH AH N,rEkxmEndeSxn,5.06
recompense,R EH K AH M P EH N S,rEkxmpEns,0.25
reconcile,R EH K IH N S AY L,rEkInsYl,1.14
reconciliation,R EH K IH N S IH L IY EY SH IH N,rEkInsIlieSIn,1.02
recondition,R IY K AH N D IH SH AH N,rikxndISxn,0.02
reconnaissance,R IH K AA N IH Z IH N S,rIkanIzIns,1.73
reconsider,R IH K IH N S IH D AH R,rIkInsIdxr,5.02
reconsideration,R IY K AH N S IH D AH R EY SH AH N,rikxnsIdxreSxn,0.08
reconstruct,R IH K IH N S T R AH K T,rIkInstrxkt,1.14
reconstruction,R IY K AH N S T R AH K SH AH N,rikxnstrxkSxn,1.61
reconvene,R IY K AH N V IY N,rikxnvin,0.61
record,R IH K AO R D,rIkcrd,85.59
recorder,R IH K AO R D AH R,rIkcrdxr,4.94
recording,R IH K AO R D IH NG,rIkcrdIG,14.67
recount,R IH K AW N T,rIkWnt,0.73
recoup,R IH K UW P,rIkup,0.24
recourse,R IY K OW R S,rikors,0.75
recover,R IH K AH V AH R,rIkxvxr,8.02
recoverable,R IH K AH V AH R AH B AH L,rIkxvxrxbxl,0.1
recovery,R IH K AH V AH R IY,rIkxvxri,9.1
recreate,R IY K R IY EY T,rikriet,1.04
recreation,R EH K R IY EY SH IH N,rEkrieSIn,1.86
recreational,R EH K R IY EY SH AH N AH L,rEkrieSxnxl,1.04
recrimination,R IH K R IH M IH N EY SH AH N,rIkrImIneSxn,0.14
recruit,R IH K R UW T,rIkrut,3.69
recruiter,R IH K R UW T AH R,rIkrutxr,0.69
recruitment,R IH K R UW T M AH N T,rIkrutmxnt,0.82
rectangle,R EH K T AE NG G AH L,rEktAGgxl,0.22
rectangular,R EH K T AE NG G Y UH L AH R,rEktAGgyUlxr,0.43
rectitude,R EH K T IH T UW D,rEktItud,0.16
rector,R EH K T AH R,rEktxr,0.35
recumbent,R IH K AH M B IH N T,rIkxmbInt,0.02
recuperate,R IH K UW P AH R EY T,rIkupxret,0.35
recur,R IH K AH R,rIkxr,0.04
recurrence,R IH K AH R AH N S,rIkxrxns,0.29
recurrent,R IH K AH R AH N T,rIkxrxnt,0.25
red,R EH D,rEd,148.06
redcoat,R EH D K OW T,rEdkot,0.08
redden,R EH D AH N,rEdxn,0.04
redder,R EH D AH R,rEdxr,0.25
reddish,R EH D IH SH,rEdIS,0.2
redecorate,R IY D EH K AH R EY T,ridEkxret,1.02
redecoration,R IY D EH K AH R EY SH AH N,ridEkxreSxn,0.12
rededicate,R IY D EH D AH K EY T,ridEdxket,0.16
redeem,R IH D IY M,rIdim,1.63
redefine,R IY D IH F AY N,ridIfYn,0.29
redefinition,R IY D EH F AH N IH SH AH N,ridEfxnISxn,0.04
redemption,R IH D EH M P SH IH N,rIdEmpSIn,2.2
redevelopment,R IY D IH V EH L AH P M AH N T,ridIvElxpmxnt,0.25
redhead,R EH D HH EH D,rEdhEd,3.65
redheaded,R EH D HH EH D IH D,rEdhEdId,0.88
redirect,R IY D AH R EH K T,ridxrEkt,0.94
rediscover,R IY D IH S K AH V AH R,ridIskxvxr,0.22
rediscovery,R IY D IH S K AH V R IY,ridIskxvri,0.02
redistribute,R IY D IH S T R IH B Y UW T,ridIstrIbyut,0.16
redneck,R EH D N EH K,rEdnEk,1.76
redo,R IY D UW,ridu,1.59
redouble,R IY D AH B AH L,ridxbxl,0.22
redouble,R IY D AH B AH L,ridxbxl,0.22
redouble,R IY D AH B AH L,ridxbxl,0.22
redouble,R IY D AH B AH L,ridxbxl,0.22
redress,R IH D R EH S,rIdrEs,0.22
reduce,R IH D UW S,rIdus,4.29
reducer,R IH D UW S AH R,rIdusxr,0.06
reduction,R IH D AH K SH IH N,rIdxkSIn,1.73
redundancy,R IH D AH N D IH N S IY,rIdxndInsi,0.63
redundant,R IH D AH N D AH N T,rIdxndxnt,1.45
redwood,R EH D W UH D,rEdwUd,0.73
reedy,R IY D IY,ridi,0.14
reef,R IY F,rif,4
reek,R IY K,rik,0.9
reek,R IY K,rik,0.9
reek,R IY K,rik,0.9
reek,R IY K,rik,0.9
reel,R IY L,ril,3.25
reemerge,R IY IH M AH R JH,riImxrJ,0.08
reenact,R IY IH N AE K T,riInAkt,0.31
reestablish,R IY IH S T AE B L IH SH,riIstAblIS,0.43
reevaluation,R IY IH V AE L Y UW EY SH AH N,riIvAlyueSxn,0.1
reexamination,R IY IH G Z AE M AH N EY SH AH N,riIgzAmxneSxn,0.02
refer,R IH F AH R,rIfxr,7.33
referee,R EH F AH R IY,rEfxri,3.59
reference,R EH F AH R N S,rEfxrns,8.47
referendum,R EH F AH R EH N D AH M,rEfxrEndxm,0.1
referent,R EH F AH R AH N T,rEfxrxnt,0.02
referral,R IH F AH R AH L,rIfxrxl,0.55
refill,R IY F IH L,rifIl,2.78
refinance,R IY F AY N AE N S,rifYnAns,0.02
refine,R IH F AY N,rIfYn,0.43
refinement,R IH F AY N M AH N T,rIfYnmxnt,0.53
reflect,R IH F L EH K T,rIflEkt,4.18
reflectance,R IH F L EH K T AH N S,rIflEktxns,0.04
reflection,R IH F L EH K SH AH N,rIflEkSxn,5.02
reflective,R IH F L EH K T IH V,rIflEktIv,0.61
reflector,R IH F L EH K T AH R,rIflEktxr,0.27
reflex,R IY F L EH K S,riflEks,2.27
reform,R IH F AO R M,rIfcrm,3.61
reformation,R EH F AH R M EY SH IH N,rEfxrmeSIn,0.2
reformatory,R IH F AO R M AH T OW R IY,rIfcrmxtori,0.35
reformer,R IH F AO R M AH R,rIfcrmxr,0.22
reformulate,R IY F AO R M Y AH L EY T,rifcrmyxlet,0.04
refract,R IH F R AE K T,rIfrAkt,0.04
refraction,R IH F R AE K SH IH N,rIfrAkSIn,0.16
refractive,R IH F R AE K T IH V,rIfrAktIv,0.04
refractory,R IH F R AE K T AH R IY,rIfrAktxri,0.06
refrain,R IH F R EY N,rIfren,2.04
refresh,R IH F R EH SH,rIfrES,2.49
refresher,R IH F R EH SH AH R,rIfrESxr,0.29
refreshing,R IH F R EH SH IH NG,rIfrESIG,3.67
refreshingly,R IY F R EH SH IH NG L IY,rifrESIGli,0.18
refreshment,R IH F R EH SH M AH N T,rIfrESmxnt,1
refrigerate,R IH F R IH JH AH R EY T,rIfrIJxret,0.2
refrigeration,R IH F R IH JH AH R EY SH AH N,rIfrIJxreSxn,0.33
refrigerator,R IH F R IH JH AH R EY T AH R,rIfrIJxretxr,8.37
refuel,R IY F Y UW AH L,rifyuxl,0.84
refuge,R EH F Y UW JH,rEfyuJ,2.45
refugee,R EH F Y UH JH IY,rEfyUJi,1.92
refund,R IH F AH N D,rIfxnd,2.76
refurbish,R IH F AH R B IH SH,rIfxrbIS,0.08
refurbishing,R IY F AH R B IH SH IH NG,rifxrbISIG,0.12
refusal,R IH F Y UW Z AH L,rIfyuzxl,1.29
refuse,R IH F Y UW Z,rIfyuz,20.98
refute,R IH F Y UW T,rIfyut,0.67
regain,R IH G EY N,rIgen,2.63
regal,R IY G AH L,rigxl,1.14
regale,R IH G EY L,rIgel,0.2
regalia,R IH G EY L Y AH,rIgelyx,0.12
regard,R IH G AA R D,rIgard,7.35
regarding,R IH G AA R D IH NG,rIgardIG,8.47
regatta,R IH G AA T AH,rIgatx,0.55
regency,R IY JH IH N S IY,riJInsi,0.61
regenerate,R IY JH EH N AH R EY T,riJEnxret,0.41
regeneration,R IH JH EH N AH R EY SH AH N,rIJEnxreSxn,0.67
regent,R IY JH IH N T,riJInt,1.67
regime,R EY ZH IY M,reZim,2.31
regimen,R EH JH IH M AH N,rEJImxn,0.78
regiment,R EH JH IH M AH N T,rEJImxnt,4.84
regimentation,R EH JH IH M AH N T EY SH IH N,rEJImxnteSIn,0.1
region,R IY JH IH N,riJIn,5.02
regional,R IY JH AH N AH L,riJxnxl,3.12
regionalism,R IY JH AH N AH L IH Z AH M,riJxnxlIzxm,0.02
register,R EH JH IH S T AH R,rEJIstxr,11
registrar,R EH JH IH S T R AA R,rEJIstrar,0.53
registration,R EH JH IH S T R EY SH IH N,rEJIstreSIn,6.53
registry,R EH JH IH S T R IY,rEJIstri,1.27
regression,R IH G R EH SH AH N,rIgrESxn,0.65
regret,R IH G R EH T,rIgrEt,27.14
regrettable,R IH G R EH T AH B AH L,rIgrEtxbxl,0.92
regrettably,R IH G R EH T AH B L IY,rIgrEtxbli,0.65
regroup,R IY G R UW P,rigrup,1.41
regrouping,R IY G R UW P IH NG,rigrupIG,0.27
regular,R EH G Y UH L AH R,rEgyUlxr,33.86
regularity,R EH G Y UH L AE R AH T IY,rEgyUlArxti,0.31
regularly,R EH G Y AH L AH R L IY,rEgyxlxrli,3.37
regulate,R EH G Y UH L EY T,rEgyUlet,0.76
regulation,R EH G Y UH L EY SH IH N,rEgyUleSIn,2.47
regulator,R EH G Y AH L EY T AH R,rEgyxletxr,0.8
regulatory,R EH G Y AH L AH T AO R IY,rEgyxlxtcri,0.27
rehabilitate,R IH HH AH B IH L IH T EY T,rIhxbIlItet,0.41
rehabilitation,R IY AH B IH L AH T EY SH AH N,rixbIlxteSxn,1.61
rehash,R IH HH AE SH,rIhAS,0.41
rehearsal,R IH HH AH R S AH L,rIhxrsxl,12.45
rehearse,R IH HH AH R S,rIhxrs,4.51
reign,R EY N,ren,3.12
reign,R EY N,ren,3.12
reign,R EY N,ren,3.12
reign,R EY N,ren,3.12
reign,R EY N,ren,3.12
reign,R EY N,ren,3.12
reign,R EY N,ren,3.12
reign,R EY N,ren,3.12
reign,R EY N,ren,3.12
reimburse,R IY IH M B AH R S,riImbxrs,0.61
reimbursement,R IY IH M B AH R S M AH N T,riImbxrsmxnt,0.14
rein,R EY N,ren,0.76
rein,R EY N,ren,0.76
rein,R EY N,ren,0.76
rein,R EY N,ren,0.76
rein,R EY N,ren,0.76
rein,R EY N,ren,0.76
rein,R EY N,ren,0.76
rein,R EY N,ren,0.76
rein,R EY N,ren,0.76
reincarnate,R IY IH N K AA R N EY T,riInkarnet,0.27
reinforce,R IY IH N F OW R S,riInfors,0.94
reinforcement,R IY IH N F OW R S M AH N T,riInforsmxnt,0.86
reinstall,R IY IH N S T AA L,riInstal,0.04
reinstate,R IY IH N S T EY T,riInstet,0.96
reintroduce,R IY IH N T R AH D UW S,riIntrxdus,0.18
reissue,R IY IH SH UW,riISu,0.08
reiterate,R IY IH T AH R EY T,riItxret,0.65
reject,R IH JH EH K T,rIJEkt,4.24
rejection,R IH JH EH K SH AH N,rIJEkSxn,3.29
rejoice,R IH JH OY S,rIJOs,1.69
rejoicing,R IH JH OY S IH NG,rIJOsIG,0.88
rejoin,R IH JH OY N,rIJOn,1.25
rejoinder,R IH JH OY N D AH R,rIJOndxr,0.04
rekindling,R IY K IH N D L IH NG,rikIndlIG,0.12
relate,R IH L EY T,rIlet,4.75
relation,R IH L EY SH IH N,rIleSIn,4.12
relational,R IY L EY SH AH N AH L,rileSxnxl,0.1
relationship,R IH L EY SH AH N SH IH P,rIleSxnSIp,67.69
relative,R EH L IH T IH V,rElItIv,7.78
relatively,R EH L AH T IH V L IY,rElxtIvli,3.25
relativism,R EH L AH T IH V IH Z AH M,rElxtIvIzxm,0.04
relativistic,R EH L AH T IH V IH S T IH K,rElxtIvIstIk,0.04
relativity,R EH L IH T IH V AH T IY,rElItIvxti,0.76
relax,R IH L AE K S,rIlAks,96.78
relaxation,R IH L AE K S EY SH IH N,rIlAkseSIn,1.57
relay,R IY L EY,rile,2.98
relearn,R IY L EH R N,rilErn,0.04
release,R IH L IY S,rIlis,36.29
relegate,R EH L AH G EY T,rElxget,0.04
relent,R IH L EH N T,rIlEnt,0.25
relentless,R IH L EH N T L IH S,rIlEntlIs,1.55
relentlessly,R IH L EH N T L AH S L IY,rIlEntlxsli,0.53
relentlessness,R IH L EH N T L IH S N EH S,rIlEntlIsnEs,0.02
relevance,R EH L AH V AH N S,rElxvxns,1.61
relevancy,R EH L AH V AH N S IY,rElxvxnsi,0.1
relevant,R EH L AH V AH N T,rElxvxnt,5.61
reliability,R IY L AY AH B IH L AH T IY,rilYxbIlxti,0.31
reliable,R IH L AY AH B AH L,rIlYxbxl,5.9
reliance,R IH L AY IH N S,rIlYIns,0.27
relic,R EH L IH K,rElIk,1.33
relict,R EH L IH K T,rElIkt,0.04
relief,R IH L IY F,rIlif,14.59
relieve,R IH L IY V,rIliv,5.57
religion,R IH L IH JH IH N,rIlIJIn,13.86
religionist,R IY L IH JH AH N IH S T,rilIJxnIst,0.02
religiosity,R IH L IH JH IY AA S IH T IY,rIlIJiasIti,0.04
religious,R IH L IH JH IH S,rIlIJIs,13.86
relinquish,R IH L IH NG K W IH SH,rIlIGkwIS,0.9
relinquishing,R IY L IH NG K W IH SH IH NG,rilIGkwISIG,0.14
relish,R EH L IH SH,rElIS,1.88
relive,R IH L IH V,rIlIv,1.69
reliving,R IY L IH V IH NG,rilIvIG,0.57
reload,R IY L OW D,rilod,1.39
relocation,R IY L OW K EY SH AH N,rilokeSxn,0.76
reluctance,R IH L AH K T IH N S,rIlxktIns,0.9
reluctant,R IH L AH K T AH N T,rIlxktxnt,2.51
rely,R IH L AY,rIlY,7.18
remain,R IH M EY N,rImen,33.22
remainder,R IH M EY N D AH R,rImendxr,1.51
remains,R IY M EY N Z,rimenz,17.45
remake,R IY M EY K,rimek,1.02
remand,R IH M AE N D,rImAnd,0.16
remark,R IH M AA R K,rImark,4.39
remarkable,R IH M AA R K AH B AH L,rImarkxbxl,12.57
remarkably,R IY M AA R K AH B L IY,rimarkxbli,1.98
remarry,R IY M EH R IY,rimEri,0.86
remedial,R IH M IY D IY AH L,rImidixl,0.39
remedy,R EH M AH D IY,rEmxdi,2.31
remember,R IH M EH M B AH R,rImEmbxr,542.47
remembering,R IY M EH M B R IH NG,rimEmbrIG,5.78
remembrance,R IH M EH M B R AH N S,rImEmbrxns,0.73
remind,R IH M AY N D,rImYnd,36.92
reminder,R IY M AY N D AH R,rimYndxr,3.76
reminisce,R EH M AH N IH S,rEmxnIs,0.73
reminiscence,R EH M AH N IH S AH N S,rEmxnIsxns,0.12
reminiscent,R EH M AH N IH S AH N T,rEmxnIsxnt,0.43
remission,R IH M IH SH IH N,rImISIn,0.88
remit,R IH M IH T,rImIt,0.14
remnant,R EH M N IH N T,rEmnInt,0.24
remodel,R IH M AA D AH L,rImadxl,0.76
remold,R IY M OW L D,rimold,0.02
remorse,R IH M AO R S,rImcrs,3.02
remorseful,R IH M AO R S F AH L,rImcrsfxl,0.31
remorseless,R IH M AO R S L IH S,rImcrslIs,0.1
remote,R IH M OW T,rImot,13.98
remoteness,R IY M OW T N AH S,rimotnxs,0.08
remotest,R IH M OW T AH S T,rImotxst,0.22
remount,R IH M AW N T,rImWnt,0.04
removable,R IH M UW V AH B AH L,rImuvxbxl,0.12
removal,R IH M UW V AH L,rImuvxl,2.06
remove,R IH M UW V,rImuv,21.25
remuneration,R IH M Y UW N AH R EY SH AH N,rImyunxreSxn,0.22
remunerative,R IH M Y UW N AH R EY T IH V,rImyunxretIv,0.02
renaissance,R EH N IH S AA N S,rEnIsans,2.2
renal,R IY N AH L,rinxl,1.59
rename,R IY N EY M,rinem,0.22
rend,R EH N D,rEnd,0.31
render,R EH N D AH R,rEndxr,2.02
rendering,R EH N D AH R IH NG,rEndxrIG,1.06
rendezvous,R AA N D IH V UW,randIvu,6.12
rendition,R EH N D IH SH IH N,rEndISIn,0.43
renew,R IH N UW,rInu,2.18
renewable,R IY N UW AH B AH L,rinuxbxl,0.16
renewal,R IH N UW AH L,rInuxl,0.96
renounce,R IH N AW N S,rInWns,1.69
renovate,R EH N AH V EY T,rEnxvet,0.25
renovation,R EH N AH V EY SH IH N,rEnxveSIn,0.84
renown,R IH N AW N,rInWn,0.39
renowned,R IH N AW N D,rInWnd,1.31
rent,R EH N T,rEnt,34.55
rental,R EH N T AH L,rEntxl,4.82
renunciation,R IH N AH N S IY EY SH IH N,rInxnsieSIn,0.22
reopen,R IY OW P AH N,riopxn,1.59
reorder,R IY AO R D AH R,ricrdxr,0.08
reorganization,R IY AO R G AH N IH Z EY SH AH N,ricrgxnIzeSxn,0.35
reorganize,R IY AO R G IH N AY Z,ricrgInYz,0.41
reorient,R IY AO R IY EH N T,ricriEnt,0.04
reorientation,R IY OW R IY EH N T EY SH AH N,rioriEnteSxn,0.08
rep,R EH P R IY Z EH T AH T IH V,rEprizEtxtIv,5.16
repaint,R IY P EY N T,ripent,0.45
repainting,R IY P EY N T IH NG,ripentIG,0.22
repair,R IH P AE R,rIpAr,8.82
repairing,R IY P EH R IH NG,ripErIG,0.82
repairman,R IY P EH R M AE N,ripErmAn,1.06
reparation,R EH P AH R EY SH IH N,rEpxreSIn,0.12
repartee,R EH P AH R T IY,rEpxrti,0.39
repay,R IY P EY,ripe,5.2
repayment,R IY P EY M AH N T,ripemxnt,0.24
repeal,R IH P IY L,rIpil,0.16
repeat,R IH P IY T,rIpit,33.02
repeater,R IH P IY T AH R,rIpitxr,0.27
repel,R IH P EH L,rIpEl,0.67
repellent,R IH P EH L AH N T,rIpElxnt,0.78
repent,R IH P EH N T,rIpEnt,2.41
repentance,R IH P EH N T AH N S,rIpEntxns,0.61
repentant,R IH P EH N T AH N T,rIpEntxnt,0.24
repercussion,R IY P AH R K AH SH IH N,ripxrkxSIn,0.08
repertoire,R EH P AH R T W AA R,rEpxrtwar,0.45
repertory,R EH P AH R T OW R IY,rEpxrtori,0.31
repetition,R EH P AH T IH SH IH N,rEpxtISIn,0.69
repetitious,R EH P AH T IH SH AH S,rEpxtISxs,0.14
repetitive,R IH P EH T IH T IH V,rIpEtItIv,0.57
rephrase,R IY F R EY Z,rifrez,1.65
replace,R IH P L EY S,rIples,13.35
replacement,R IH P L EY S M AH N T,rIplesmxnt,6.22
replant,R IY P L AE N T,riplAnt,0.14
replenish,R IH P L EH N IH SH,rIplEnIS,0.51
replenishment,R IH P L EH N IH SH M AH N T,rIplEnISmxnt,0.02
replete,R IH P L IY T,rIplit,0.16
replica,R EH P L IH K AH,rEplIkx,1.1
replication,R EH P L AH K EY SH AH N,rEplxkeSxn,0.22
reply,R IH P L AY,rIplY,4.8
report,R IH P OW R T,rIport,108
reportage,R IH P OW R T IH JH,rIportIJ,0.12
reporter,R IH P AO R T AH R,rIpcrtxr,20.39
reporting,R IH P AO R T IH NG,rIpcrtIG,11.55
reportorial,R EH P AH R T OW R IY AH L,rEpxrtorixl,0.04
repose,R IH P OW Z,rIpoz,0.57
repository,R IH P AA Z IH T OW R IY,rIpazItori,0.25
reprehensible,R EH P R IH HH EH N S AH B AH L,rEprIhEnsxbxl,0.57
represent,R EH P R IY Z EH N T,rEprizEnt,15.16
representation,R EH P R AH Z EH N T EY SH AH N,rEprxzEnteSxn,2.49
representational,R EH P R AH Z AH N T EY SH AH N AH L,rEprxzxnteSxnxl,0.04
representative,R EH P R IH Z EH N T AH T IH V,rEprIzEntxtIv,5.29
repress,R IH P R EH S,rIprEs,0.37
repression,R IH P R EH SH AH N,rIprESxn,0.82
repressive,R IH P R EH S IH V,rIprEsIv,0.24
reprieve,R IH P R IY V,rIpriv,1
reprimand,R EH P R AH M AE N D,rEprxmAnd,0.53
reprint,R IY P R IH N T,riprInt,0.14
reprisal,R IH P R AY Z AH L,rIprYzxl,0.25
reproach,R IH P R OW CH,rIproC,0.45
reprobate,R EH P R AH B EY T,rEprxbet,0.22
reproduce,R IH P R AH D UW S,rIprxdus,1.55
reproducible,R IY P R AH D UW S AH B AH L,riprxdusxbxl,0.04
reproduction,R IY P R AH D AH K SH AH N,riprxdxkSxn,1.47
reproductive,R IY P R AH D AH K T IH V,riprxdxktIv,1.06
reproof,R IH P R UW F,rIpruf,0.04
republic,R IH P AH B L IH K,rIpxblIk,5.61
repudiate,R IH P Y UW D IY EY T,rIpyudiet,0.25
repudiation,R IH P Y UW D IY EY SH AH N,rIpyudieSxn,0.1
repugnance,R IH P AH G N IH N S,rIpxgnIns,0.06
repugnant,R IY P AH G N AH N T,ripxgnxnt,0.76
repulse,R IH P AH L S,rIpxls,0.25
repulsion,R IH P AH L SH IH N,rIpxlSIn,0.16
repulsive,R IH P AH L S IH V,rIpxlsIv,2.02
reputable,R EH P Y UW T AH B AH L,rEpyutxbxl,0.84
reputation,R EH P Y UW T EY SH IH N,rEpyuteSIn,19.27
repute,R IH P Y UW T,rIpyut,0.22
request,R IH K W EH S T,rIkwEst,25.57
requester,R IH K W EH S T AH R,rIkwEstxr,0.02
require,R IH K W AY R,rIkwYr,10.63
requirement,R IH K W AY R M AH N T,rIkwYrmxnt,1.43
requisite,R EH K W AH Z IH T,rEkwxzIt,0.37
requisition,R EH K W AH Z IH SH IH N,rEkwxzISIn,1.12
reread,R IY R IY D,ririd,0.45
resale,R IY S EY L,risel,0.24
rescind,R IH S IH N D,rIsInd,0.53
rescue,R EH S K Y UW,rEskyu,25.41
reseal,R IY S IY L,risil,0.06
research,R IY S AH R CH,risxrC,33.1
researcher,R IY S AH R CH AH R,risxrCxr,0.75
resemblance,R IH Z EH M B L IH N S,rIzEmblIns,3.53
resemble,R IH Z EH M B AH L,rIzEmbxl,1.71
resent,R IH Z EH N T,rIzEnt,5.75
resentful,R IH Z EH N T F AH L,rIzEntfxl,0.57
resentment,R IH Z EH N T M AH N T,rIzEntmxnt,1.49
reservation,R EH Z AH R V EY SH IH N,rEzxrveSIn,10.31
reserve,R IH Z AH R V,rIzxrv,7.18
reservoir,R EH Z AH R V W AA R,rEzxrvwar,1.86
resettlement,R IY S EH T AH L M AH N T,risEtxlmxnt,0.1
reshape,R IY SH EY P,riSep,0.22
reside,R IH Z AY D,rIzYd,1.1
residence,R EH Z IH D IH N S,rEzIdIns,8.25
resident,R EH Z IH D AH N T,rEzIdxnt,7.33
residential,R EH Z AH D EH N CH AH L,rEzxdEnCxl,1.78
residual,R IH Z IH JH UW AH L,rIzIJuxl,1.25
residue,R EH Z AH D UW,rEzxdu,2.75
resign,R IH Z AY N,rIzYn,5.04
resignation,R EH Z IH G N EY SH IH N,rEzIgneSIn,3.75
resilience,R IH Z IH L Y AH N S,rIzIlyxns,0.14
resin,R EH Z AH N,rEzxn,0.59
resist,R IH Z IH S T,rIzIst,12.88
resistance,R IH Z IH S T AH N S,rIzIstxns,8.45
resistant,R IY Z IH S T AH N T,rizIstxnt,0.9
resistor,R IH Z IH S T AH R,rIzIstxr,0.12
resolute,R EH Z AH L UW T,rEzxlut,0.61
resolution,R EH Z AH L UW SH IH N,rEzxluSIn,2.94
resolve,R IH Z AA L V,rIzalv,4.84
resonance,R EH Z AH N AH N S,rEzxnxns,0.65
resonant,R EH Z AH N AH N T,rEzxnxnt,0.12
resort,R IH Z AO R T,rIzcrt,6.9
resound,R IH Z AW N D,rIzWnd,0.18
resounding,R IY S AW N D IH NG,risWndIG,0.45
resource,R IY S OW R S,risors,1.63
resourceful,R IY S AO R S F AH L,riscrsfxl,1.45
resourcefulness,R IY S AO R S F AH L N AH S,riscrsfxlnxs,0.25
respect,R IH S P EH K T,rIspEkt,71.45
respectability,R IH S P EH K T AH B IH L IH T IY,rIspEktxbIlIti,0.75
respectable,R IH S P EH K T AH B AH L,rIspEktxbxl,5.65
respectful,R IH S P EH K T F AH L,rIspEktfxl,1.9
respecting,R IH S P EH K T IH NG,rIspEktIG,1.06
respective,R IH S P EH K T IH V,rIspEktIv,0.8
respiration,R EH S P AH R EY SH IH N,rEspxreSIn,1.24
respirator,R EH S P AH R EY T AH R,rEspxretxr,0.73
respiratory,R EH S P AH R IH T OW R IY,rEspxrItori,2.78
respite,R EH S P AH T,rEspxt,0.47
resplendent,R IH S P L EH N D IH N T,rIsplEndInt,0.22
respond,R IH S P AA N D,rIspand,14.1
respondent,R IH S P AA N D IH N T,rIspandInt,0.14
response,R IH S P AA N S,rIspans,16.1
responsibility,R IH S P AA N S IH B IH L IH T IY,rIspansIbIlIti,35.41
responsible,R IH S P AA N S IH B AH L,rIspansIbxl,45.06
responsive,R IH S P AA N S IH V,rIspansIv,0.78
responsiveness,R IH S P AA N S IH V N IH S,rIspansIvnIs,0.04
rest,R EH S T,rEst,212.96
rest,R EH S T,rEst,212.96
rest,R EH S T,rEst,212.96
rest,R EH S T,rEst,212.96
restate,R IY S T EY T,ristet,0.14
restatement,R IY S T EY T M AH N T,ristetmxnt,0.02
restaurant,R EH S T R AA N T,rEstrant,46.53
restaurateur,R EH S T AH R AH T AH R,rEstxrxtxr,0.08
restful,R EH S T F AH L,rEstfxl,0.75
restitution,R EH S T IH T UW SH IH N,rEstItuSIn,0.55
restless,R EH S T L AH S,rEstlxs,4.84
restlessness,R EH S T L AH S N AH S,rEstlxsnxs,0.31
restock,R IY S T AA K,ristak,0.45
restoration,R EH S T AH R EY SH IH N,rEstxreSIn,0.94
restorative,R IH S T OW R AH T IH V,rIstorxtIv,0.08
restore,R IH S T OW R,rIstor,4.96
restorer,R IH S T AO R AH R,rIstcrxr,0.22
restoring,R IH S T AO R IH NG,rIstcrIG,0.98
restrain,R IH S T R EY N,rIstren,1.53
restraint,R IH S T R EY N T,rIstrent,2.57
restrict,R IH S T R IH K T,rIstrIkt,0.55
restricting,R IY S T R IH K T IH NG,ristrIktIG,0.25
restriction,R IH S T R IH K SH IH N,rIstrIkSIn,0.51
restrictive,R IH S T R IH K T IH V,rIstrIktIv,0.27
restructure,R IY S T R AH K CH AH R,ristrxkCxr,0.25
result,R IH Z AH L T,rIzxlt,19.76
resultant,R IH Z AH L T AH N T,rIzxltxnt,0.06
resume,R IH Z UW M,rIzum,5.69
resumption,R IH Z AH M P SH AH N,rIzxmpSxn,0.06
resurgence,R IY S AH R JH AH N S,risxrJxns,0.08
resurrect,R EH Z AH R EH K T,rEzxrEkt,0.71
resurrection,R EH Z AH R EH K SH AH N,rEzxrEkSxn,3.37
retail,R IY T EY L,ritel,2.31
retailer,R IY T EY L AH R,ritelxr,0.04
retailing,R IY T EY L IH NG,ritelIG,0.08
retain,R IH T EY N,rIten,2.37
retainer,R IY T EY N AH R,ritenxr,2.12
retaliate,R IH T AE L IY EY T,rItAliet,1.25
retaliation,R IH T AE L IY EY SH AH N,rItAlieSxn,0.94
retaliatory,R IH T AE L IY AH T OW R IY,rItAlixtori,0.25
retard,R IH T AA R D,rItard,3.94
retardation,R IY T AA R D EY SH AH N,ritardeSxn,0.31
retch,R EH CH,rEC,0.29
retch,R EH CH,rEC,0.29
retch,R EH CH,rEC,0.29
retch,R EH CH,rEC,0.29
retell,R IY T EH L,ritEl,0.02
retelling,R IY T EH L IH NG,ritElIG,0.04
retention,R IH T EH N CH IH N,rItEnCIn,0.27
retentive,R IH T EH N T IH V,rItEntIv,0.06
retentiveness,R IH T EH N T IH V N AH S,rItEntIvnxs,0.02
rethink,R IY TH IH NG K,riTIGk,1.76
retina,R EH T AH N AH,rEtxnx,0.73
retinal,R EH T AH N AH L,rEtxnxl,0.69
retire,R IH T AY R,rItYr,9.78
retirement,R IH T AY R M AH N T,rItYrmxnt,8.45
retort,R IH T AO R T,rItcrt,0.25
retouching,R IY T AH CH IH NG,ritxCIG,0.08
retrace,R IH T R EY S,rItres,0.69
retract,R IH T R AE K T,rItrAkt,1.45
retraction,R IH T R AE K SH AH N,rItrAkSxn,1
retrain,R IY T R EY N,ritren,0.1
retreat,R IH T R IY T,rItrit,9.49
retrench,R IH T R EH N CH,rItrEnC,0.02
retribution,R EH T R AH B Y UW SH IH N,rEtrxbyuSIn,1.67
retrieval,R IH T R IY V AH L,rItrivxl,1.12
