Item,Pronunciation,Phonology,Frequency
disbelief,D IH S B IH L IY F,dIsbIlif,0.49
disbelieve,D IH S B AH L IY V,dIsbxliv,0.16
disburse,D IH S B AH R S,dIsbxrs,0.04
disbursement,D IH S B AH R S M AH N T,dIsbxrsmxnt,0.08
discard,D IH S K AA R D,dIskard,1.08
discern,D IH S AH R N,dIsxrn,0.33
discernible,D IH S AH R N AH B AH L,dIsxrnxbxl,0.18
discernment,D IH S AH R N M AH N T,dIsxrnmxnt,0.04
discharge,D IH S CH AA R JH,dIsCarJ,6.41
disciple,D IH S AY P AH L,dIsYpxl,1.02
disciplinary,D IH S AH P L IH N EH R IY,dIsxplInEri,1.61
discipline,D IH S AH P L IH N,dIsxplIn,9.06
disclaim,D IH S K L EY M,dIsklem,0.1
disclaimer,D IH S K L EY M AH R,dIsklemxr,0.08
disclose,D IH S K L OW Z,dIskloz,1.73
disclosure,D IH S K L OW ZH AH R,dIskloZxr,1
discomfort,D IH S K AH M F AH R T,dIskxmfxrt,1.59
disconcerting,D IH S K AH N S AH R T IH NG,dIskxnsxrtIG,0.53
disconnect,D IH S K AH N EH K T,dIskxnEkt,1.84
discontent,D IH S K IH N T EH N T,dIskIntEnt,0.9
discontented,D IH S K AH N T EH N T IH D,dIskxntEntId,0.12
discontinue,D IH S K AH N T IH N Y UW,dIskxntInyu,0.67
discord,D IH S K AO R D,dIskcrd,1.02
discount,D IH S K AW N T,dIskWnt,4.76
discourage,D IH S K AH R IH JH,dIskxrIJ,1.33
discouragement,D IH S K AH R IH JH M AH N T,dIskxrIJmxnt,0.08
discouraging,D IH S K AH R IH JH IH NG,dIskxrIJIG,0.8
discourse,D IH S K OW R S,dIskors,0.39
discourteous,D IH S K AH R T IY AH S,dIskxrtixs,0.24
discover,D IH S K AH V AH R,dIskxvxr,12.04
discoverer,D IH S K AH V AH R AH R,dIskxvxrxr,0.2
discovery,D IH S K AH V AH R IY,dIskxvxri,11.45
discredit,D IH S K R EH D IH T,dIskrEdIt,0.9
discreet,D IH S K R IY T,dIskrit,4.06
discreet,D IH S K R IY T,dIskrit,4.06
discreet,D IH S K R IY T,dIskrit,4.06
discreet,D IH S K R IY T,dIskrit,4.06
discrepancy,D IH S K R EH P AH N S IY,dIskrEpxnsi,0.88
discrete,D IH S K R IY T,dIskrit,0.33
discrete,D IH S K R IY T,dIskrit,0.33
discrete,D IH S K R IY T,dIskrit,0.33
discrete,D IH S K R IY T,dIskrit,0.33
discretion,D IH S K R EH SH AH N,dIskrESxn,3.67
discretionary,D IH S K R EH SH AH N EH R IY,dIskrESxnEri,0.41
discriminate,D IH S K R IH M AH N EY T,dIskrImxnet,0.8
discriminating,D IH S K R IH M AH N EY T IH NG,dIskrImxnetIG,0.49
discrimination,D IH S K R IH M AH N EY SH AH N,dIskrImxneSxn,2.18
discriminatory,D IH S K R IH M AH N AH T AO R IY,dIskrImxnxtcri,0.16
discuss,D IH S K AH S,dIskxs,45.67
discussion,D IH S K AH SH AH N,dIskxSxn,12.14
disdain,D IH S D EY N,dIsden,0.53
disdainful,D IH S D EY N F AH L,dIsdenfxl,0.06
disease,D IH Z IY Z,dIziz,26.18
diseased,D IH Z IY Z D,dIzizd,1.14
disembody,D IH S IH B AA D IY,dIsIbadi,0.02
disenfranchise,D IH S IH N F R AE N CH AY Z,dIsInfrAnCYz,0.02
disenfranchisement,D IH S EH N F R AE N CH IH Z M AH N T,dIsEnfrAnCIzmxnt,0.02
disengage,D IH S EH N G EY JH,dIsEngeJ,1.06
disengagement,D IH S EH N G EY JH M AH N T,dIsEngeJmxnt,0.12
disentangle,D IH S EH N T AE NG G AH L,dIsEntAGgxl,0.06
disfavor,D IH S F EY V AH R,dIsfevxr,0.06
disfigure,D IH S F IH G Y AH R,dIsfIgyxr,0.08
disgrace,D IH S G R EY S,dIsgres,8.02
disgraceful,D IH S G R EY S F AH L,dIsgresfxl,1.82
disguise,D IH S G AY Z,dIsgYz,7.8
disgust,D IH S G AH S T,dIsgxst,2.76
disgusting,D IH S G AH S T IH NG,dIsgxstIG,26.61
dish,D IH SH,dIS,11.45
disharmony,D IH S HH AA R M AH N IY,dIsharmxni,0.08
dishearten,D IH S HH AA R T AH N,dIshartxn,0.02
dishonest,D IH S AA N IH S T,dIsanIst,2.59
dishonesty,D IH S AA N IH S T IY,dIsanIsti,0.57
dishonor,D IH S AA N AH R,dIsanxr,1.2
dishwasher,D IH SH W AA SH AH R,dISwaSxr,2.02
dishwater,D IH SH W AO T AH R,dISwctxr,0.22
disillusion,D IH S AH L UW ZH IH N,dIsxluZIn,0.24
disillusionment,D IH S IH L UW ZH AH N M AH N T,dIsIluZxnmxnt,0.27
disinclination,D IH S IH N K L IH N EY SH IH N,dIsInklIneSIn,0.04
disintegrate,D IH S IH N T IH G R EY T,dIsIntIgret,0.51
disintegration,D IH S IH N T AH G R EY SH AH N,dIsIntxgreSxn,0.24
disinter,D IH S AH N T AH R,dIsxntxr,0.06
disinterest,D IH S IH N T AH R IH S T,dIsIntxrIst,0.12
disinterested,D IH S IH N T AH R AH S T IH D,dIsIntxrxstId,0.35
disjoint,D IH S JH OY N T,dIsJOnt,0.04
disk,D IH S K,dIsk,6.63
dislike,D IH S L AY K,dIslYk,3.92
dislocate,D IH S L OW K EY T,dIsloket,0.2
dislocation,D IH S L OW K EY SH IH N,dIslokeSIn,0.29
dislodge,D IH S L AA JH,dIslaJ,0.25
disloyal,D IH S L OY AH L,dIslOxl,0.96
disloyalty,D IH S L OY AH L T IY,dIslOxlti,0.45
dismal,D IH Z M AH L,dIzmxl,0.94
dismay,D IH S M EY,dIsme,0.45
dismaying,D IH S M EY IH NG,dIsmeIG,0.02
dismember,D IH S M EH M B AH R,dIsmEmbxr,0.31
dismemberment,D IH S M EH M B AH R M AH N T,dIsmEmbxrmxnt,0.35
dismiss,D IH S M IH S,dIsmIs,5.47
dismissal,D IH S M IH S AH L,dIsmIsxl,1.12
disobedience,D IH S AH B IY D IY AH N S,dIsxbidixns,0.76
disobedient,D IH S AH B IY D IY AH N T,dIsxbidixnt,0.22
disobey,D IH S AH B EY,dIsxbe,1.65
disorder,D IH S AO R D AH R,dIscrdxr,7.14
disorderly,D IH S AO R D AH R L IY,dIscrdxrli,1.35
disorganization,D IH S AO R G AH N IH Z EY SH AH N,dIscrgxnIzeSxn,0.12
disorganize,D IH S AO R G IH N AY Z,dIscrgInYz,0.04
disorient,D IH S AO R IY EH N T,dIscriEnt,0.08
disown,D IH S OW N,dIson,0.41
disparagement,D IH S P AE R IH JH M AH N T,dIspArIJmxnt,0.02
disparate,D IH S P AE R AH T,dIspArxt,0.14
disparity,D IH S P AE R AH T IY,dIspArxti,0.2
dispassionate,D IH S P AE SH IH N IH T,dIspASInIt,0.14
dispatch,D IH S P AE CH,dIspAC,6.86
dispel,D IH S P EH L,dIspEl,0.27
dispensary,D IH S P EH N S AH R IY,dIspEnsxri,0.41
dispensation,D IH S P AH N S EY SH IH N,dIspxnseSIn,0.35
dispense,D IH S P EH N S,dIspEns,1.35
dispenser,D IH S P EH N S AH R,dIspEnsxr,1.02
dispersal,D IH S P AH R S AH L,dIspxrsxl,0.45
disperse,D IH S P AH R S,dIspxrs,1.78
dispersion,D IH S P AH R ZH AH N,dIspxrZxn,0.06
displace,D IH S P L EY S,dIsples,0.41
displacement,D IH S P L EY S M AH N T,dIsplesmxnt,0.84
display,D IH S P L EY,dIsple,8.53
displease,D IH S P L IY Z,dIspliz,0.43
displeasure,D IH S P L EH ZH AH R,dIsplEZxr,0.67
disposal,D IH S P OW Z AH L,dIspozxl,4.9
dispose,D IH S P OW Z,dIspoz,3.14
disposition,D IH S P AH Z IH SH IH N,dIspxzISIn,2.16
dispossess,D IH S P AH Z EH S,dIspxzEs,0.08
disproportionate,D IH S P R AH P OW R SH AH N IH T,dIsprxporSxnIt,0.25
disprove,D IH S P R UW V,dIspruv,0.61
dispute,D IH S P Y UW T,dIspyut,3.14
disqualify,D IH S K W AA L AH F AY,dIskwalxfY,0.65
disquiet,D IH S K W AY AH T,dIskwYxt,0.08
disquieting,D IH S K W AY IH T IH NG,dIskwYItIG,0.12
disregard,D IH S R IH G AA R D,dIsrIgard,3.51
disrepair,D IH S R IH P AE R,dIsrIpAr,0.16
disreputable,D IH S R EH P Y UW T AH B AH L,dIsrEpyutxbxl,0.16
disrepute,D IH S R IH P Y UW T,dIsrIpyut,0.14
disrespect,D IH S R IH S P EH K T,dIsrIspEkt,5.24
disrobe,D IH S R OW B,dIsrob,0.27
disrupt,D IH S R AH P T,dIsrxpt,1.27
disruption,D IH S R AH P SH AH N,dIsrxpSxn,1
disruptive,D IH S R AH P T IH V,dIsrxptIv,0.43
dissatisfaction,D IH S S AE T IH S F AE K SH IH N,dIssAtIsfAkSIn,0.27
dissect,D IH S EH K T,dIsEkt,0.98
dissection,D IH S EH K SH AH N,dIsEkSxn,0.86
dissemble,D IH S EH M B AH L,dIsEmbxl,0.12
disseminate,D IH S EH M AH N EY T,dIsEmxnet,0.08
dissemination,D IH S EH M AH N EY SH AH N,dIsEmxneSxn,0.06
dissension,D IH S EH N CH IH N,dIsEnCIn,0.27
dissent,D IH S EH N T,dIsEnt,0.59
dissent,D IH S EH N T,dIsEnt,0.59
dissent,D IH S EH N T,dIsEnt,0.59
dissent,D IH S EH N T,dIsEnt,0.59
dissenter,D IH S EH N T AH R,dIsEntxr,0.02
disservice,D IH S S AH R V AH S,dIssxrvxs,0.35
dissident,D IH S IH D IH N T,dIsIdInt,0.18
dissimilar,D IH S S IH M AH L AH R,dIssImxlxr,0.25
dissimulation,D IH S IH M Y AH L EY SH AH N,dIsImyxleSxn,0.02
dissipate,D IH S AH P EY T,dIsxpet,0.22
dissociate,D IH S OW S IY EY T,dIsosiet,0.04
dissociation,D IH S OW S IY EY SH AH N,dIsosieSxn,0.04
dissolution,D IH S AH L UW SH IH N,dIsxluSIn,0.1
dissolve,D IH Z AA L V,dIzalv,1.86
dissonance,D IH S IH N IH N S,dIsInIns,0.06
dissuade,D IH S W EY D,dIswed,0.53
distal,D IH S T AH L,dIstxl,0.63
distance,D IH S T IH N S,dIstIns,25.61
distant,D IH S T AH N T,dIstxnt,8.61
distaste,D IH S T EY S T,dIstest,0.25
distasteful,D IH S T EY S T F AH L,dIstestfxl,1.18
distillation,D IH S T IH L EY SH IH N,dIstIleSIn,0.14
distiller,D IH S T IH L AH R,dIstIlxr,0.06
distinct,D IH S T IH NG T,dIstIGt,3.04
distinction,D IH S T IH NG K SH AH N,dIstIGkSxn,2.94
distinctive,D IH S T IH NG K T IH V,dIstIGktIv,1.55
distinctively,D IH S T IH NG K T IH V L IY,dIstIGktIvli,0.02
distinctly,D IH S T IH NG K T L IY,dIstIGktli,1.88
distinguish,D IH S T IH NG G W IH SH,dIstIGgwIS,1.78
distinguishable,D IH S T IH NG G W IH SH AH B AH L,dIstIGgwISxbxl,0.02
distinguished,D IH S T IH NG G W IH SH T,dIstIGgwISt,6.18
distort,D IH S T AO R T,dIstcrt,0.39
distortion,D IH S T AO R SH AH N,dIstcrSxn,1.18
distract,D IH S T R AE K T,dIstrAkt,4.88
distraction,D IH S T R AE K SH AH N,dIstrAkSxn,3.92
distraught,D IH S T R AO T,dIstrct,1.55
distress,D IH S T R EH S,dIstrEs,7.27
distressing,D IH S T R EH S IH NG,dIstrEsIG,0.82
distribute,D IH S T R IH B Y UW T,dIstrIbyut,1.49
distribution,D IH S T R IH B Y UW SH IH N,dIstrIbyuSIn,3.08
distributor,D IH S T R IH B Y UW T AH R,dIstrIbyutxr,1.53
distributorship,D IH S T R IH B Y AH T AH R SH IH P,dIstrIbyxtxrSIp,0.02
district,D IH S T R IH K T,dIstrIkt,20.94
distrust,D IH S T R AH S T,dIstrxst,0.75
disturb,D IH S T AH R B,dIstxrb,11.1
disturbance,D IH S T AH R B AH N S,dIstxrbxns,3.94
disturber,D IH S T AH R B AH R,dIstxrbxr,0.02
disturbing,D IH S T AH R B IH NG,dIstxrbIG,9.08
ditch,D IH CH,dIC,7.86
ditty,D IH T IY,dIti,0.78
diurnal,D AY AH R N AH L,dYxrnxl,0.04
diva,D IY V AH,divx,1.53
divan,D AY V AE N,dYvAn,0.12
dive,D AY V,dYv,12.82
diver,D AY V AH R,dYvxr,2.43
diverge,D AH V AH R JH,dxvxrJ,0.02
divergence,D IH V AH R JH AH N S,dIvxrJxns,0.06
divergent,D IH V AH R JH AH N T,dIvxrJxnt,0.08
divers,D AY V AH R Z,dYvxrz,1.59
diverse,D AY V AH R S,dYvxrs,0.76
diversification,D IH V AH R S AH F AH K EY SH AH N,dIvxrsxfxkeSxn,0.14
diversify,D AH V AH R S AH F AY,dxvxrsxfY,0.29
diversion,D IH V AH R ZH AH N,dIvxrZxn,3.1
diversionary,D IH V AH R ZH AH N EH R IY,dIvxrZxnEri,0.49
diversity,D IH V AH R S IH T IY,dIvxrsIti,1.1
divert,D IH V AH R T,dIvxrt,2.02
divest,D AY V EH S T,dYvEst,0.08
divestiture,D IH V EH S T IH CH AH R,dIvEstICxr,0.06
divide,D AH V AY D,dxvYd,5.84
dividend,D IH V AH D EH N D,dIvxdEnd,0.37
divider,D IH V AY D AH R,dIvYdxr,0.16
divination,D IH V AH N EY SH IH N,dIvxneSIn,0.1
divine,D AH V AY N,dxvYn,11.65
diving,D AY V IH NG,dYvIG,6.29
divinity,D AH V IH N IH T IY,dxvInIti,0.84
divisible,D AH V IH Z IH B AH L,dxvIzIbxl,0.08
division,D AH V IH ZH IH N,dxvIZIn,18.55
divisional,D IH V IH ZH AH N AH L,dIvIZxnxl,0.31
divisive,D AH V AY S IH V,dxvYsIv,0.14
divorce,D AH V OW R S,dxvors,32.73
divorcee,D IH V OW R S IY,dIvorsi,0.47
divulge,D AH V AH L JH,dxvxlJ,1.27
dizziness,D IH Z IY N AH S,dIzinxs,0.92
dizzy,D IH Z IY,dIzi,8.43
do,D UW,du,6135.59
do,D UW,du,6135.59
do,D UW,du,6135.59
do,D UW,du,6135.59
do,D UW,du,6135.59
do,D UW,du,6135.59
do,D UW,du,6135.59
do,D UW,du,6135.59
do,D UW,du,6135.59
do,D UW,du,6135.59
do,D UW,du,6135.59
do,D UW,du,6135.59
do,D UW,du,6135.59
do,D UW,du,6135.59
do,D UW,du,6135.59
do,D UW,du,6135.59
do,D UW,du,6135.59
do,D UW,du,6135.59
do,D UW,du,6135.59
do,D UW,du,6135.59
do,D UW,du,6135.59
do,D UW,du,6135.59
do,D UW,du,6135.59
do,D UW,du,6135.59
do,D UW,du,6135.59
docile,D AA S AH L,dasxl,0.53
dock,D AA K,dak,9.75
docket,D AA K IH T,dakIt,1.2
dockside,D AA K S AY D,daksYd,0.08
doctor,D AA K T AH R,daktxr,263.94
doctorate,D AA K T AH R AH T,daktxrxt,0.9
doctrinaire,D AA K T R AH N AE R,daktrxnAr,0.02
doctrinal,D AA K T R AH N AH L,daktrxnxl,0.08
doctrine,D AA K T R AH N,daktrxn,0.84
document,D AA K Y UH M AH N T,dakyUmxnt,10.1
documentary,D AA K Y UH M EH N T AH R IY,dakyUmEntxri,5.84
documentation,D AA K Y UH M AH N T EY SH IH N,dakyUmxnteSIn,1.35
dodge,D AA JH,daJ,7.76
doer,D UW R,dur,0.41
doff,D AA F,daf,0.16
dog,D AO G,dcg,192.84
dogged,D AO G AH D,dcgxd,0.51
doghouse,D AO G HH AW S,dcghWs,1.12
dogleg,D AO G L EH G,dcglEg,0.12
dogma,D AO G M AH,dcgmx,0.25
dogmatic,D AO G M AE T IH K,dcgmAtIk,0.2
dogwood,D AO G W UH D,dcgwUd,0.2
doing,D UW IH NG,duIG,1029.25
dolce,D OW L CH EY,dolCe,0.94
dole,D OW L,dol,0.96
doll,D AA L,dal,24.76
dollar,D AA L AH R,dalxr,27.65
dolly,D AA L IY,dali,6
dolphin,D AO L F AH N,dclfxn,2.76
domain,D OW M EY N,domen,2.59
dome,D OW M,dom,1.96
domestic,D AH M EH S T IH K,dxmEstIk,6.88
domesticity,D OW M EH S T IH S IH T IY,domEstIsIti,0.27
domicile,D AA M AH S AY L,damxsYl,0.35
dominance,D AA M AH N IH N S,damxnIns,0.76
dominant,D AA M AH N AH N T,damxnxnt,1.61
dominate,D AA M AH N EY T,damxnet,1.86
domination,D AA M AH N EY SH IH N,damxneSIn,1.55
domineer,D AA M AH N IH R,damxnIr,0.04
dominion,D AH M IH N Y AH N,dxmInyxn,1.14
don,D AA N,dan,6295.78
donate,D OW N EY T,donet,3.98
donation,D OW N EY SH IH N,doneSIn,3.51
donkey,D AO NG K IY,dcGki,5.35
donor,D OW N AH R,donxr,4.08
doom,D UW M,dum,5.61
doomsday,D UW M Z D EY,dumzde,0.8
door,D OW AH R,doxr,292.06
doorbell,D OW R B EH L,dorbEl,8.33
doorkeeper,D OW R K IY P AH R,dorkipxr,0.06
doorknob,D OW R N AA B,dornab,1.69
doorman,D OW R M AE N,dormAn,3.18
doorstep,D OW R S T EH P,dorstEp,3.37
doorway,D OW R W EY,dorwe,3.22
dope,D OW P,dop,16.08
dormant,D AO R M AH N T,dcrmxnt,1.16
dormitory,D AO R M AH T OW R IY,dcrmxtori,1
dosage,D OW S IH JH,dosIJ,2
dose,D OW S,dos,5.29
dot,D AA T,dat,6.63
dot,D AA T,dat,6.63
dote,D OW T,dot,0.22
dotting,D AA T IH NG,datIG,0.1
double,D AH B AH L,dxbxl,62.71
doubloon,D AH B L UW N,dxblun,0.12
doubly,D AH B AH L IY,dxbxli,0.55
doubt,D AW T,dWt,62.84
doubtful,D AW T F AH L,dWtfxl,1.63
dough,D OW,do,15.88
dour,D AW R,dWr,0.16
douse,D UW S,dus,0.8
dove,D OW V,dov,5.57
dovetail,D AH V T EY L,dxvtel,0.08
dowager,D AW IH JH AH R,dWIJxr,0.29
dowel,D AW AH L,dWxl,0.06
dower,D AW AH R,dWxr,0.02
down,D AW N,dWn,1490.27
downbeat,D AW N B IY T,dWnbit,0.25
downcast,D AW N K AE S T,dWnkAst,0.14
downfall,D AW N F AO L,dWnfcl,1.25
downgrade,D AW N G R EY D,dWngred,0.1
downhill,D AW N HH IH L,dWnhIl,2.47
downpour,D AW N P OW R,dWnpor,0.06
downright,D AW N R AY T,dWnrYt,2.37
downstairs,D AW N S T EH R Z,dWnstErz,38.92
downstream,D AW N S T R IY M,dWnstrim,1.25
downtown,D AW N T AW N,dWntWn,21.92
downtrodden,D AW N T R AA D AH N,dWntradxn,0.31
downturn,D AW N T AH R N,dWntxrn,0.08
downward,D AW N W AH R D,dWnwxrd,1.18
downwind,D AW N W IH N D,dWnwInd,0.55
dowry,D AW R IY,dWri,1.47
doze,D OW Z,doz,0.39
dozen,D AH Z AH N,dxzxn,24.14
drab,D R AE B,drAb,0.8
draft,D R AE F T,drAft,7.27
draft,D R AE F T,drAft,7.27
draft,D R AE F T,drAft,7.27
draft,D R AE F T,drAft,7.27
draftee,D R AE F T IY,drAfti,0.1
draftee,D R AE F T IY,drAfti,0.1
draftee,D R AE F T IY,drAfti,0.1
draftee,D R AE F T IY,drAfti,0.1
draftee,D R AE F T IY,drAfti,0.1
draftee,D R AE F T IY,drAfti,0.1
draftee,D R AE F T IY,drAfti,0.1
draftee,D R AE F T IY,drAfti,0.1
draftee,D R AE F T IY,drAfti,0.1
drafting,D R AE F T IH NG,drAftIG,0.43
drafty,D R AE F T IY,drAfti,0.63
drafty,D R AE F T IY,drAfti,0.63
drafty,D R AE F T IY,drAfti,0.63
drafty,D R AE F T IY,drAfti,0.63
drafty,D R AE F T IY,drAfti,0.63
drafty,D R AE F T IY,drAfti,0.63
drafty,D R AE F T IY,drAfti,0.63
drafty,D R AE F T IY,drAfti,0.63
drafty,D R AE F T IY,drAfti,0.63
drag,D R AE G,drAg,26.45
dragger,D R AE G AH R,drAgxr,0.04
dragnet,D R AE G N EH T,drAgnEt,0.35
dragon,D R AE G IH N,drAgIn,19.29
dragoon,D R AH G UW N,drxgun,0.06
drain,D R EY N,dren,8.63
drainage,D R EY N IH JH,drenIJ,0.9
draining,D R EY N IH NG,drenIG,1.35
dram,D R AE M,drAm,0.2
drama,D R AA M AH,dramx,20.16
dramatic,D R AH M AE T IH K,drxmAtIk,9.78
dramatics,D R AH M AE T IH K S,drxmAtIks,0.31
dramatist,D R AA M AH T IH S T,dramxtIst,0.1
dramatization,D R AA M AH T AH Z EY SH IH N,dramxtxzeSIn,0.08
dramatize,D R AA M AH T AY Z,dramxtYz,0.22
drape,D R EY P,drep,1.04
draper,D R EY P AH R,drepxr,0.51
drapery,D R EY P AH R IY,drepxri,0.06
drastic,D R AE S T IH K,drAstIk,2.51
drastically,D R AE S T IH K L IY,drAstIkli,0.31
draught,D R AE F T,drAft,0.47
draught,D R AE F T,drAft,0.47
draught,D R AE F T,drAft,0.47
draught,D R AE F T,drAft,0.47
draughty,D R AE F T IY,drAfti,0.12
draughty,D R AE F T IY,drAfti,0.12
draughty,D R AE F T IY,drAfti,0.12
draughty,D R AE F T IY,drAfti,0.12
draughty,D R AE F T IY,drAfti,0.12
draughty,D R AE F T IY,drAfti,0.12
draughty,D R AE F T IY,drAfti,0.12
draughty,D R AE F T IY,drAfti,0.12
draughty,D R AE F T IY,drAfti,0.12
draw,D R AO,drc,40.41
drawback,D R AO B AE K,drcbAk,0.63
drawbridge,D R AO B R IH JH,drcbrIJ,0.53
drawer,D R AO R,drcr,13
drawing,D R AO IH NG,drcIG,16.02
drawl,D R AO L,drcl,0.08
dread,D R EH D,drEd,2.51
dreadful,D R EH D F AH L,drEdfxl,8
dream,D R IY M,drim,133.29
dreamer,D R IY M AH R,drimxr,3.04
dreamless,D R IY M L AH S,drimlxs,0.12
dreamlike,D R IY M L AY K,drimlYk,0.16
dreamy,D R IY M IY,drimi,1.57
dreary,D R IH R IY,drIri,1.8
drench,D R EH N CH,drEnC,0.22
dress,D R EH S,drEs,87.2
dresser,D R EH S AH R,drEsxr,3.57
dressing,D R EH S IH NG,drEsIG,15.76
dressy,D R EH S IY,drEsi,0.63
dribble,D R IH B AH L,drIbxl,1.33
drier,D R AY AH R,drYxr,0.43
drier,D R AY AH R,drYxr,0.43
drier,D R AY AH R,drYxr,0.43
drier,D R AY AH R,drYxr,0.43
drift,D R IH F T,drIft,6.41
drill,D R IH L,drIl,13.75
drilling,D R IH L IH NG,drIlIG,2.29
drink,D R IH NG K,drIGk,247.39
drinker,D R IH NG K AH R,drIGkxr,1.86
drinking,D R IH NG K IH NG,drIGkIG,52.65
drip,D R IH P,drIp,5.12
drive,D R AY V,drYv,153.14
driver,D R AY V AH R,drYvxr,47.37
driveway,D R AY V W EY,drYvwe,6.73
driving,D R AY V IH NG,drYvIG,74.12
drizzle,D R IH Z AH L,drIzxl,0.43
drizzly,D R IH Z L IY,drIzli,0.1
drone,D R OW N,dron,2.82
droop,D R UW P,drup,0.33
drop,D R AA P,drap,130.61
droplet,D R AA P L AH T,draplxt,0.04
dropout,D R AA P AW T,drapWt,0.84
dropping,D R AA P IH NG,drapIG,16.2
dross,D R AA S,dras,0.08
drought,D R AW T,drWt,1.37
drove,D R OW V,drov,28.86
drover,D R OW V AH R,drovxr,0.1
drown,D R AW N,drWn,10.59
drowse,D R AW Z,drWz,0.06
drowsy,D R AW Z IY,drWzi,0.73
drudgery,D R AH JH AH R IY,drxJxri,0.18
drug,D R AH G,drxg,45.22
drugstore,D R AH G S T OW R,drxgstor,4.29
drum,D R AH M,drxm,8.47
drumlin,D R AH M L IH N,drxmlIn,0.33
drummer,D R AH M AH R,drxmxr,3.67
drunk,D R AH NG K,drxGk,76.55
drunkard,D R AH NG K AH R D,drxGkxrd,1.22
drunken,D R AH NG K AH N,drxGkxn,6.18
drunkenness,D R AH NG K AH N N AH S,drxGkxnnxs,0.71
drunker,D R AH NG K AH R,drxGkxr,0.53
dry,D R AY,drY,42.82
dryer,D R AY AH R,drYxr,4.53
dryer,D R AY AH R,drYxr,4.53
dryer,D R AY AH R,drYxr,4.53
dryer,D R AY AH R,drYxr,4.53
drying,D R AY IH NG,drYIG,1.67
dryness,D R AY N AH S,drYnxs,0.14
drywall,D R AY W AA L,drYwal,0.31
du,D UW,du,4.65
du,D UW,du,4.65
du,D UW,du,4.65
du,D UW,du,4.65
du,D UW,du,4.65
du,D UW,du,4.65
du,D UW,du,4.65
du,D UW,du,4.65
du,D UW,du,4.65
du,D UW,du,4.65
du,D UW,du,4.65
du,D UW,du,4.65
du,D UW,du,4.65
du,D UW,du,4.65
du,D UW,du,4.65
du,D UW,du,4.65
du,D UW,du,4.65
du,D UW,du,4.65
du,D UW,du,4.65
du,D UW,du,4.65
du,D UW,du,4.65
du,D UW,du,4.65
du,D UW,du,4.65
du,D UW,du,4.65
du,D UW,du,4.65
dual,D UW AH L,duxl,1.12
dual,D UW AH L,duxl,1.12
dual,D UW AH L,duxl,1.12
dual,D UW AH L,duxl,1.12
dualism,D UW AH L IH Z AH M,duxlIzxm,0.02
duality,D UW AE L IH T IY,duAlIti,0.27
dub,D AH B,dxb,1.08
dubious,D UW B IY AH S,dubixs,1.43
duchess,D AH CH IH S,dxCIs,4.47
duck,D AH K,dxk,24.76
duct,D AH K T,dxkt,3.14
ductwork,D AH K T W AH R K,dxktwxrk,0.08
dud,D AH D,dxd,1.25
duds,D AH D Z,dxdz,1.35
due,D UW,du,44.61
due,D UW,du,44.61
due,D UW,du,44.61
due,D UW,du,44.61
due,D UW,du,44.61
due,D UW,du,44.61
due,D UW,du,44.61
due,D UW,du,44.61
due,D UW,du,44.61
due,D UW,du,44.61
due,D UW,du,44.61
due,D UW,du,44.61
due,D UW,du,44.61
due,D UW,du,44.61
due,D UW,du,44.61
due,D UW,du,44.61
due,D UW,du,44.61
due,D UW,du,44.61
due,D UW,du,44.61
due,D UW,du,44.61
due,D UW,du,44.61
due,D UW,du,44.61
due,D UW,du,44.61
due,D UW,du,44.61
due,D UW,du,44.61
duel,D UW AH L,duxl,2.35
duel,D UW AH L,duxl,2.35
duel,D UW AH L,duxl,2.35
duel,D UW AH L,duxl,2.35
duet,D UW EH T,duEt,1.29
duffel,D AH F AH L,dxfxl,1.49
duffer,D AH F AH R,dxfxr,0.63
dugout,D AH G AW T,dxgWt,0.9
duke,D UW K,duk,25.04
dulcet,D AH L S IH T,dxlsIt,0.14
dull,D AH L,dxl,12.08
duller,D AH L AH R,dxlxr,0.27
dullest,D AH L AH S T,dxlxst,0.33
dullness,D AH L N AH S,dxlnxs,0.14
dumb,D AH M,dxm,46.96
dumbbell,D AH M B EH L,dxmbEl,0.49
dummy,D AH M IY,dxmi,9.8
dump,D AH M P,dxmp,28.82
dumping,D AH M P IH NG,dxmpIG,3.98
dun,D AH N,dxn,0.25
dune,D UW N,dun,1
dung,D AH NG,dxG,1.76
dungeon,D AH N JH IH N,dxnJIn,2.57
dunk,D AH NG K,dxGk,2.59
dupe,D UW P,dup,0.65
duplex,D UW P L EH K S,duplEks,0.47
duplicate,D UW P L IH K IH T,duplIkIt,2.29
duplication,D UW P L IH K EY SH IH N,duplIkeSIn,0.14
durability,D UH R AH B IH L IH T IY,dUrxbIlIti,0.22
durable,D UH R AH B AH L,dUrxbxl,0.35
duration,D UH R EY SH IH N,dUreSIn,1.59
duress,D UH R EH S,dUrEs,1.16
during,D UH R IH NG,dUrIG,75.92
dusk,D AH S K,dxsk,1.2
dusky,D AH S K IY,dxski,0.41
dust,D AH S T,dxst,23.84
dustbin,D AH S T B IH N,dxstbIn,0.14
dusting,D AH S T IH NG,dxstIG,1.31
dusty,D AH S T IY,dxsti,5.55
duty,D UW T IY,duti,50.96
dwarf,D W AO R F,dwcrf,3.08
dwell,D W EH L,dwEl,2.78
dweller,D W EH L AH R,dwElxr,0.18
dwelling,D W EH L IH NG,dwElIG,1.33
dwindle,D W IH N D AH L,dwIndxl,0.1
dye,D AY,dY,3.86
dye,D AY,dY,3.86
dye,D AY,dY,3.86
dye,D AY,dY,3.86
dye,D AY,dY,3.86
dye,D AY,dY,3.86
dye,D AY,dY,3.86
dye,D AY,dY,3.86
dye,D AY,dY,3.86
dying,D AY IH NG,dYIG,66.98
dynamic,D AY N AE M IH K,dYnAmIk,2.1
dynamite,D AY N AH M AY T,dYnxmYt,10.1
dynamo,D AY N AH M OW,dYnxmo,0.51
dynastic,D AY N AE S T IH K,dYnAstIk,0.02
dynasty,D AY N IH S T IY,dYnIsti,2.55
dysentery,D IH S AH N T EH R IY,dIsxntEri,0.9
dyspeptic,D IH S P EH P T IH K,dIspEptIk,0.08
dysplasia,D IH S P L EY ZH AH,dIspleZx,0.12
dystrophy,D IH S T R AH F IY,dIstrxfi,0.22
each,IY CH,iC,253.25
eager,IY G AH R,igxr,6.86
eagerness,IY G AH R N AH S,igxrnxs,0.25
eagle,IY G AH L,igxl,11.49
ear,IH R,Ir,32
eardrum,IH R D R AH M,Irdrxm,0.29
eared,IH R D,Ird,0.02
earl,AH R L,xrl,20.43
earlier,AH R L IY AH R,xrlixr,39.41
earliest,AH R L IY AH S T,xrlixst,2.31
early,AH R L IY,xrli,108.04
earmark,IH R M AA R K,Irmark,0.06
earn,AH R N,xrn,15.35
earn,AH R N,xrn,15.35
earn,AH R N,xrn,15.35
earn,AH R N,xrn,15.35
earnest,AH R N IH S T,xrnIst,1.57
earnestness,AH R N AH S T N AH S,xrnxstnxs,0.06
earning,AH R N IH NG,xrnIG,2.57
earphone,IH R F OW N,Irfon,0.12
earring,IH R R IH NG,IrrIG,2.71
earth,AH R TH,xrT,99.49
earthly,AH R TH L IY,xrTli,1.49
earthquake,AH R TH K W EY K,xrTkwek,6.37
earthworm,AH R TH W AH R M,xrTwxrm,0.14
earthy,AH R TH IY,xrTi,0.41
ease,IY Z,iz,19.1
easel,IY Z AH L,izxl,0.27
easement,IY Z M AH N T,izmxnt,0.16
easier,IY Z IY AH R,izixr,39.45
easiest,IY Z IY IH S T,iziIst,4
easily,IY Z AH L IY,izxli,22.57
east,IY S T,ist,49.55
eastern,IY S T AH R N,istxrn,8.12
easterner,IY S T AH R N AH R,istxrnxr,0.06
easy,IY Z IY,izi,265.71
easygoing,IY Z IY G OW IH NG,izigoIG,0.43
eat,IY T,it,251.88
eatable,IY T AH B AH L,itxbxl,0.06
eater,IY T AH R,itxr,1.57
eating,IY T IH NG,itIG,60.82
eats,IY T S,its,12.65
eave,IY V,iv,0.1
eave,IY V,iv,0.1
eave,IY V,iv,0.1
eave,IY V,iv,0.1
ebb,EH B,Eb,0.35
ebony,EH B IH N IY,EbIni,0.86
ebullient,EH B Y UH L AH N T,EbyUlxnt,0.04
eccentric,IH K S EH N T R IH K,IksEntrIk,3.51
eccentricity,EH K S EH N T R IH S IH T IY,EksEntrIsIti,0.2
ecclesiastical,IH K L IY Z IY AE S T IH K AH L,IkliziAstIkxl,0.22
echelon,EH SH AH L AA N,ESxlan,0.88
echo,EH K OW,Eko,6.86
eclat,EY K L AA,ekla,0.02
eclectic,EH K L EH K T IH K,EklEktIk,0.39
eclipse,IH K L IH P S,IklIps,2.82
ecole,IH K OW L,Ikol,0.08
ecological,EH K AH L AA JH IH K AH L,EkxlaJIkxl,0.45
economic,EH K IH N AA M IH K,EkInamIk,4.96
economical,IY K AH N AA M IH K AH L,ikxnamIkxl,0.33
economics,IY K AH N AA M IH K S,ikxnamIks,2.47
economist,IH K AA N AH M IH S T,IkanxmIst,0.22
economize,IH K AA N AH M AY Z,IkanxmYz,0.24
economy,IH K AA N AH M IY,Ikanxmi,5.8
ecstasy,EH K S T IH S IY,EkstIsi,3.18
ecstatic,IH K S T AE T IH K,IkstAtIk,1.35
ecumenical,EH K Y UH M EH N IH K AH L,EkyUmEnIkxl,0.18
eddy,EH D IY,Edi,3.61
edema,IH D IY M AH,Idimx,1.06
edge,EH JH,EJ,23.51
edging,EH JH IH NG,EJIG,0.29
edgy,EH JH IY,EJi,2.27
edible,EH D AH B AH L,Edxbxl,1.37
edifice,EH D AH F IH S,EdxfIs,0.41
edify,EH D AH F AY,EdxfY,0.06
edit,EH D IH T,EdIt,1.51
editing,EH D IH T IH NG,EdItIG,2.12
edition,IH D IH SH IH N,IdISIn,4.88
editor,EH D IH T AH R,EdItxr,12.41
editorial,EH D IH T OW R IY AH L,EdItorixl,2.18
editorship,EH D IH T AH R SH IH P,EdItxrSIp,0.02
educate,EH JH IH K EY T,EJIket,2.04
education,EH JH IH K EY SH IH N,EJIkeSIn,19.53
educational,EH JH UH K EY SH AH N AH L,EJUkeSxnxl,3.27
educator,EH JH UH K EY T AH R,EJUketxr,0.47
eel,IY L,il,1.43
eerie,IH R IY,Iri,1.75
efface,IH F EY S,Ifes,0.02
effect,IH F EH K T,IfEkt,23.9
effecting,IY F EH K T IH NG,ifEktIG,0.1
effective,IH F EH K T IH V,IfEktIv,10.51
effectiveness,IY F EH K T IH V N AH S,ifEktIvnxs,0.53
effectual,IH F EH K CH UW AH L,IfEkCuxl,0.06
effeminate,IH F EH M AH N IH T,IfEmxnIt,0.29
effete,IH F IY T,Ifit,0.06
efficacious,EH F AH K EY SH AH S,EfxkeSxs,0.2
efficacy,EH F AH K AH S IY,Efxkxsi,0.29
efficiency,IH F IH SH AH N S IY,IfISxnsi,2.73
efficient,IH F IH SH AH N T,IfISxnt,4.96
effluent,EH F L UW AH N T,Efluxnt,0.08
effluvium,IH F L UW V IY AH M,Ifluvixm,0.02
effort,EH F AH R T,Efxrt,19.35
effortless,EH F AH R T L IH S,EfxrtlIs,0.41
effusive,IH F Y UW S IH V,IfyusIv,0.14
egg,EH G,Eg,26.04
egghead,EH G HH EH D,EghEd,1.12
eggshell,EH G SH EH L,EgSEl,0.45
ego,IY G OW,igo,7.49
egocentric,IY G OW S EH N T R IH K,igosEntrIk,0.24
egotism,IY G IH T IH Z AH M,igItIzxm,0.16
egotist,IY G AH T IH S T,igxtIst,0.14
egregiously,IH G R IY JH AH S L IY,IgriJxsli,0.1
egret,IY G R AH T,igrxt,0.04
eh,EY,e,51.35
eidetic,AY D EH T IH K,YdEtIk,0.06
eight,EY T,et,98.24
eighteen,EY T IY N,etin,6.08
eighteenth,EY T IY N TH,etinT,0.45
eighth,EY T TH,etT,6.86
eighty,EY T IY,eti,2.53
either,IY DH AH R,iDxr,182.51
ejaculate,IH JH AE K Y UH L EY T,IJAkyUlet,0.47
eject,IH JH EH K T,IJEkt,1.41
ejection,IH JH EH K SH AH N,IJEkSxn,0.59
eke,IY K,ik,0.08
el,EH L,El,18.84
el,EH L,El,18.84
el,EH L,El,18.84
el,EH L,El,18.84
elaborate,AH L AE B AH R EY T,xlAbxret,4.75
elaborately,IH L AE B R AH T L IY,IlAbrxtli,0.08
elaboration,IH L AE B AH R EY SH AH N,IlAbxreSxn,0.08
